post_title,self_text,time_frame
How many of you are wearing the Samsung watches with a Pixel phone,I am turning my Watch 5 Pro in to Best Buy in a few days and get about 420 in store credit Deciding on if I want to upgrade to a Galaxy Watch 7 Ultra for 70 or if the other ones eg Pixel Watch are good,2024-12-11 00:34:05
Pixel Watches and Buds should have a Check for update button just like phones,Even Android Authority agrees ,2025-03-07 17:22:20
Android 15 could let your Pixel Watch control your phones media output,,2024-04-29 19:49:12
Why do my phone alarms not go off Pixel Watch 3 41mm,,2024-10-06 11:00:11
Google Pixel Watch 5 might be getting a custom Tensor chip  After five generations of Tensorbased phones Google might also be putting a custom chip in its smartwatches,,2024-10-28 13:05:18
Pixel watch 3 vs Galaxy watch 7 for Google Pixel phone owner,Hi I am a satisfied owner of a Google Pixel 8 phone and I want to get a smart watch to pair with itI would love to know if there are any special benefits for going all in on the Google echo systemAre there any special features for Pixel Watch 3 or other benefits compatibility wise that could make the Pixel Watch 3 a better choice for meThanks in advance,2024-11-28 15:30:39
Pixel phone users using different watches,Hi Im curious how other pixel phone folks have find using other smartwatches that arent the P ixel Watch My PW1 is having pretty significant dysfunctions after less than two years and support is doing nothing for me a 350plus watch should work longer than that in my opinion so Im looking elsewhere My dad uses a Garmin and loves it but Im curious other folks opinions on what watches they use with their pixel phones,2024-09-10 05:15:09
Imagine its the year 2030 and Google has announced its latest flagship hardware products ie Pixel Phones Tablets Watches Earphones What features and specs do these products have and how different are they compared to now,Imagine its the year 2030 and Google has announced its latest flagship hardware projects ie Pixel Phones Tablets Watches What features and specs do these products have and how different are they compared to nowHere are some additional questions to encourage discussion1 How much have foldable technology advanced Are foldables truly ubqitious2 What might we expect in terms of wearables like glasses3 Has the Pixelbook returned If so how has it improved 4 How much has the form factor of the Pixel phone fundamentally changed 5 How much have the Pixel Buds changed,2025-02-16 09:08:16
For those of you who have a Pixel phone but have a Galaxy Watch andor Galaxy Buds hows the integration ,Does the audio seem worse Bad connection between the watchbuds and phone ,2024-08-19 01:35:55
My pixel watch 3 doesnt send text messages if I turn off my phone completely even though Im paying for LTE ,,2024-12-23 04:35:45
Pixel Camera 98 Major Update Brings New Features  Stability New animations UI tweaks and better stability for phones and watches,,2025-03-06 05:32:34
Pixel Watch 3 with iPhone,So I want to get a pixel watch purely for the fitness and health aspect I dont even think Id care at all if notifications and calendar wont work Can this be done Would a pixel watch work with an iPhone as a fitness track Would I need an android for the initial set up If so would that mean the data it gathers will remain out of sync until I get back home where the android phone would be Thanks for the info ,2024-12-24 12:21:03
Can Pixel Watch 3 be used with a Samsung Galaxy Phone,I am looking into buying a Pixel watch 3 but I own a Samsung Galaxy s23 Ultra phone Would I have access to all the features of the watch I am not going to be upgrading my phone for at least another couple of years so buying a Pixel phone is not an option for me I will one day be a Pixel Phone owner but not at this moment,2025-01-22 16:11:09
Why is there such a huge discrepancy between step count on my watch vs phone Pixel Watch Pixel 8,,2024-08-13 00:34:06
Pixel watch 3 disconnect from the phone ,Has anybody experience the watch disconnecting and asking you to reset it  ,2024-09-18 17:26:47
After google support took tons of personal information to help me after 4 days of chatting back and forth and them changing up how they will help me they completely dropped my problem like its not there After 2 pixel phones and one pixel watch I will leave this ecosystem forever Good bye,They knew from the beginning where I am situatedMy 6as mic 1 stopped working after recent updateThey told me I should send them bills personal details and so onThen they told me I will receive a direct switch phone and after should send mine backThen they said this wont work cause of my countryThey said I should send my phone for repairs I said okay will have not phone for 3 weeks or more but better than nothingThey replied that also this option THEY JUST NOW SUGGESTED  wont be possible im central europe and never answered againEU has consumer rights I am well in warranty and google LLC wont obey the law to repair their broken deviceThe support was as serious as being scammed by an IP scamI cant believe how a company with such a yearly net profit fucks over their customers I actually cant believe how their support is built up Its very very disturbing how self destructive they behaveGood bye Never was so disappointed,2025-03-17 23:23:18
Why is Pixel Watch trying to be a phone And pretty much any other modern smart watches out there,Context  Ive been a Pebble  Fitbit user for over 10 years I reluctantly switched to a Google Pixel Watch 3 because my Fitbit Sense 2 broke and it seemed like a dumb idea to replace it when the company is dead Ive had the Pixel Watch for about a week now and I think it could be so much better if it didnt have all these features that I would just pull out my phone to do anyway The biggest problem I have with this watch is that the damn thing cannot even last 24 hours on a charge half the time When do you guys charge this watch I used to just charge my old smart watches when I showered pretty much everyday and that was enough for them to stay on 247 on my wrist But thats not enough with this watch A 30 min shower  charge doesnt get me anywhere near 100 and the watch dies when its supposed to track my sleep I believe that a consistent 2 days battery life and quick charging capability are essential for a smartwatch because theyre expected to be on all the time for accurate health tracking Why are these not on Googles third iteration of a smartwatch or on most Wear OS smart watches out there Im seriously confused There are only 4 things I want in a watch lmk if yall value other features on Pixel Watch btw Im always looking for new useful features to learn health tracking and emergency features informative widgets  notifications with options to reply back with voice or quick replies apps that try to aid something Im doing irl and keeps me from having to pull my phone out like showing the next direction when Im navigating on Google Maps Its so disappointing to me how much bloat is on here Literally any app on this thing that is not related to health tracking tracking Like Todoist WhatsApp Gmail  are just clones of the phone app equivalent on a watch where you can scroll around around and type things Who uses these Wouldnt you just pull out your phone to do these things Ever since Fitbit got acquired Ive been struggling to understand why these major smartwatches on the market with Wear OS are so bloated with things Id rather do on a phone  that their battery lives are worse than smart watches from 510 years ago Let me know what yall think Am I missing something here ,2024-11-30 14:08:45
Pixel Watch experience trying to ditch iPhone,I was a long time Android user that switched to iOS so that I could iMessage my kids Theyre now grown enough to have phones so I can finally ditch Apple Land if I want to While I do MASSIVELY prefer android phones to iPhones love my Oneplus 8T and have been using it for the last couple of weeks again the relatively seamless integration of iOS stuff is pretty nice I bought and returned a Galaxy Watch 6 this weekend Compared to my Apple WatchiPhone 13 pairing the GW6 just didnt seem to work as tightly with my Oneplus phone as the AW does with the iP My question is does using a Pixel Phone with the Pixel Watch work as nicely as the Apple stuff With the GW6 I had issues like I would still get phone calls ringing on the phone instead of the watch despite having activated the setting to only get notifications on the watch It was a series of annoyances like that that just didnt seem to work as well as the Apple stuff Oh and the haptics were nonexistent on the GW6 compared to the AW couldnt feel them at allJust curious if Pixel Phone with Pixel Watch would work better than the experience I had with the GW6 and my Oneplus 8T Thx for the insight,2024-05-27 16:30:29
Adding an esim to pixel watch when paired phone doesnt have lte wifi only phone,HiI want to use a pixel watch lte for my son who will be only taking his watch to school He has a phone at home that is only wifi enabled no plan from a carrierI was hoping to buy a basic plan that I can get an esim for and just use on watch for emergencies or quick calls from watchtracking When I go to mobile network on pixel app at paired phone at home when both watch and phone are on wifi I get no operator supported which i think is because my phone has no sim in itWhen I bought the pixel watch lte I thought I would just load a sim card or a regular esim to it but it seems that its not as simple as that for a warchAll above being said can I just get an lte esim plan from a carrier and use on watch if my phone is only wifi phone How do I load esim to watch directly since pixel app is not letting meGemini tells me its possible  but i dont know how and if in canada can i use freedom mobile or lucky for example to get an esim or only certain supported carriers Finally are samsung lte watches the same limitationsThank you,2025-03-19 02:47:07
Why does dismissing an alarm from the pixel watch cause the bedtime mode on my pixel phone to be cancelled,Before I got my pixel watch 3  my alarm would go off at 530 but the bedtime mode was set till 6am I do this so as not to create any light in the bedroom and disturb my partner but now after the alarm is dismissed at 530 from my pixel watch 3 The bedtime mode on my phone automatically ends Is this expected,2025-01-23 00:53:12
Two Pixel Watches One Phone,I find that I avoid using the watch for FitBit activity tracking because the battery life is so poor Used watches can be quite affordable Is it possible to use two Pixel watches at the same time so that rather than waiting an hour to charge and remembering to go grab the watch off the charger I could instead just flipflop between the two Have others tried this,2025-02-03 16:22:53
I got a different phone and have a total of 7 cases and a set of pixel buds pro 2 with case if anyone is interested I have the 9XL I also have a desktop charger that charges a watch phone and pixel buds too Will give a deal on all of it,,2025-03-26 21:55:33
Cant acvitate esim on my pixel watch 3 either through the pixel phone or watch itself Anyone know of any tech reps They told me to go into a store over the phone,I went with TMobiles standalone watch plan and they said over the phone they would send an esim to my watch or through my pixel device itself For the life of me I cant get my watch to activate on either end The tech reps on the phone was unable to activate it and they told me to go into a store Is there any reps here that can help me out into activating my esim for my watch ,2025-02-03 16:26:59
Cant Activate Pixel Watch 3 LTE with BYOD Verizon Phone,As the title says I have a Pixel 7 Pro that I brought to Verizon I purchased a Pixel Watch 3 from a Verizon store and they said I should be able to activate it in the app As soon as I get to the point where it tries to download the eSIM on the phone I am told that my device is unsupported because it is not a Verizon wireless retail deviceI have called Verizon support and spent a few hours on the phone with them but I was told it was not possible to do with a BYOD device They even attempted to manually activate it but the problem is the phone cant download the eSIM to send over to the watch and it doesnt seem that the watch is capable of doing so itself Has anybody had any experience getting this to work,2025-03-13 21:23:31
If my kid leaves the phone at home and wears their Pixel Watch 3 LTE which location will Google Maps use to show their location Obvs Im hoping for a way to track the WATCH in this scenario Help,,2025-01-22 15:20:33
Pixel Camera 98 Major Update Brings New Features  Stability New animations UI tweaks and better stability for phones and watches,,2025-03-06 05:33:24
Guys do you think that a Pixel Watch 2 is worth it in 2025 I change from iPhone to Pixel and I need to replace my Apple Watch so I dont know what watch buy Samsung Galaxy watch or Pixel Watch whats the best option for a person that comes from Apple Watch,,2025-01-14 20:14:07
Pixel Watch 2 Connectivity Issue to New Samsung Phone,Hey guys  I need some helpIve bought a new Samsung Fold 6 I transferred all of my apps and everything workedHowever Ive just realised my Pixel Watch 2 is not synced to my new phoneIve tried restarting and uninstalling the pixel app but nothing When I try to sync it just says no new device foundPlease help Im actually missing seeing text and receiving calls through my watchThanks in advance,2025-03-11 17:09:30
Can You Use Pixel Watch to Listen to Spotify Through Earbuds wo Pixel Phone While Running,HelloPretty much in the title I want to know if I can downloadplay podcasts through Spotify on my Pixel Watch to my earbuds while running without using my phone I know this is possible on the Apple Watch so I am hoping it is true for the Pixel Watch 2 or 3 I have a Pixel Pro 9 and love it Thanks for your help I have searched but cant find this exact use case ,2024-11-28 00:37:10
Does Ultra Wide Band in the Pixel Watch 3 work with other brand phones,I just want to know if Ultra Wide Band phone unlock in the Pixel Watch 3 works with other brand smartphones,2025-02-23 09:39:38
Dnd and phone calls pixel watch 2,Hi there first time pixel watch 2 user Im just wondering theres a way for all phone calls to interrupt dnd on my watch the way it does on my phone Right now only started contacts are interrupting my watch when its dnd however Id like it so any call could come through rather than starring a bunch of contacts Thank you kindly ,2025-03-08 23:42:06
Oneplus 2 and Pixel 9 Pro  how to get the phone to not default to the watch when a call comes in,Title says it all I cant figure out how to get my phone to not default to the watch when calls come in And the 0health app is disconnected and I cant find the watch to reconnect it,2025-03-28 18:12:26
Can the Whatsapp App on the Pixel Watch receive and make calls when not connected to phone and is on Cellular ,,2025-03-14 00:59:04
New Pixel Watch 3 Making a call from the watch initiates a call on my phone Help,I want to be able to call frim the watch even if the phone is nearby in my pocket for instance Is that possible Is there a setting I missed or something I do happen to have bluetooth connected between the watch and the phone pixel 9 xl pro do i need to not have bluetooth on to do what I want it to do Thank you,2025-03-18 23:32:46
Pixel watch making phones Bluetooth go haywire,Yeah I just got a pixel watch 1st generation from Amazon renewed and Ive had a few problems with it The most recent problem Ive had is out of nowhere it will disconnect from my phone and when I try to reconnect it my phones Bluetooth goes haywire Its only done this since I updated it tho,2025-03-27 18:27:13
Visible vs Total Wireless on my Pixel 9 Pro I need to keep Visible on my iPhone for the Apple Watch but I badly want mmWave on the Pixel Total cant do mmWave on the pixel since they do not recognize the IMEI as a compatible phone whatsoever So annoying ,Anyone know what are the odds of TotalTracFone adding Pixels to their IMEI database Seeing as they dont even recognize my Pixel 8 Im thinking they probably wont support pixels any time soon I used a galaxy s21 IMEI to activate the Total SIM and then stuck it into the pixel Everything works fine except for mmWave which is the entire reason I decided to spend the money to get this new pixel in place of the pixel 8 I was using beforeIf I just put my Visible line on the pixel and Total on the iPhone both now have mmWave but again Apple watch isnt supported by total Im considering just dropping the watch line since I have my watch activated on ATT anyway but Im paranoid I might someday need the Visible watch line and I have it grandfathered in at 5month ,2024-09-14 23:44:00
My Pixel Watch 2 still doesnt let me hear the calls I start from it and I have to go grab my phone from the other side of the house just to chat,For a while now my PW2 has been repeatedly starting calls without playing any sound on the watch like it should I dont think its a Bluetooth issue because the connection is always there Its really frustrating for the few times I try making calls from the watchDo you know how to fix it Should I change my provider Btw it only happens with my dad it rarely happens with other contacts,2025-03-02 16:43:17
Having trouble connecting my pixel watch to my new phone,Hi all I just got a pixel 8a after having a 7a and Im trying to connect my watch 3 to the new phone I tried to pair it over and my phone recognized it for a time but now it doesnt The watch never recognized that it was paired even though the phone did It now says the pin was incorrect as an error message but any attempt to repair the device wont work either through bluetooth settings or the pixel watch app when I try there it just says TRY AGAIN idiot I cant connect it to my original phone either nowIs there any fix other than factory resetting the watchphone Everything is up to dateThanks in advance,2025-03-21 21:14:38
Pixel Watch 3 cant turn off option to receive phone calls,i have the pixel watch 3  in 41mm connecteted to the pixel 7a phoneTrying  to turn off option to receive phone calls notice that phone app is grayed out in notifications on the watch appIts also grayed out on the pixel 7a phone its connected to but from research apparantly this is normal for the phone but is there any way to turn off calls coming into the watch thank You,2025-02-19 02:54:38
Pixel Watch to Motorola Phone,I am considering getting a Pixel watch Two questions1 Does it communicate with a Motorola phone android OSand2 Does the Pixel watch have fall detectionThanks,2025-02-09 17:03:28
New OLED pixel breakthrough could make TVs phones watches and more much more energy efficient  and brighter  Dont expect to see it in your TV this year but this new tech is getting experts excited,,2025-03-18 15:15:01
Alarm keeps going off on phone instead of pixel watch when using Pixel Stand 2,I have a Pixel 8 Pro and a Pixel watch 2 and I recently purchased a Pixel Stand 2 At night when I plug my phone into USBC charging and I set an alarm on my watch and then I turn either bedtime mode or donotdisturb on via my watch the next alarm the following morning will play on my watch and my phone will stay silent However when I dock my phone on the pixel stand instead but otherwise set up the same alarm through my watch the alarm plays on my phone instead What gives I have my alarm set to adaptive ring but I never changed the setting around the only variable I added was adding the pixel standAnyone have any suggestions Id like the alarm to continue to play on my watch only,2025-03-15 00:14:58
Pixel phone  Samsung watch compatibility,I have a new phone G Pixel 9 and my trusty old Samsung smart watch 1B0A I cant seem to get them to connect is there a complete compatibility issue here or is there a workaround that Im not aware of or something Im missing,2025-02-25 07:32:38
Has anyone seen this Pixel Watch 3 shows Media Controls for something Im not playing and the only way to clear it was to reboot both the phone and the watch,I was getting a notification on my Pixel Watch 3 clock face home screen of three verticcal bars at the 600 position that media is playing but Im not playing anything When I tap it it shows the image below Charmed Nymphs just wanna have fun is identified but again Im not playing anything I looked this title up its an episode of the TV series Charmed from 20 years agoNote that PlayPause is disabled as is NEXT TRACK When I tap PREV TRACK the title label disappears and it just lets me keep tapping it with no other change yet NEXT is still disabled Then after a few seconds the label returnsPer settingsConnections the only devices connected to my watch are my Pixel 9 Pro Fold phone and Pixel Buds Pro 2 but again  nothings playing If I restart the watch it comes back  I then restarted my phone and restarted the watch and it disappearedAnyone ever seen anything like this Ive never watched this show dont have any local media for it havent opened any sites for it so Im baffled why it shows this title and has buggy controlshttpspreviewredditcgpr7msm1rje1pngwidth456formatpngautowebps0e99ad7bac2dfe5e359e72cae049e07efb46c691,2025-02-17 19:26:21
If you have a Google Pixel phone and also own a non Google Pixel smartwatch delete the Google Pixel Watch app immediately,Just posting this to hopefully save people some time and frustration that I have recently endured myself Long story short I recently got a Pixel Google 8 Pro phone I also own four different smartwatches Huawei Puma Diesel and Emporio Armani What started happening is that the messages notifications would disappear before I could even read them on my watch The phone was still okay but it kind of defeated the purpose of having a smartwatch After a lot of trial and error and online searches I finally came across another Reddit post that had this solution so I cant really take credit but its an archived post For whatever reason the Google Pixel Watch app interfered with the Wear OS app also by Google btw so uninstalling it solved the problem First of all I hate it when they preinstall crapps that I dont need And secondly shame on Google for not fixing this problem until now I was actually contemplating about getting a Pixel watch but I will definitely not be buying one now I also may steer clear from their phones in the future PS Heres the link to the other Reddit post Thanks urandomeqt     httpswwwredditcomrWearOScomments17m2ro6messagesnotificationsdisappearingonwatchhttpswwwredditcomrWearOScomments17m2ro6messagesnotificationsdisappearingonwatch,2025-02-10 20:00:04
Do I need to have an eSIM on my phone to use LTE eSIM on my Pixel Watch 3,Hi I just bought a Google Pixel Watch 3 with LTE and cant set up an eSIM for it On my phone I have a physical SIM and I was wondering if that could be the reason,2025-01-18 08:16:54
USANYH Various cases for iPhone 15 series Samsung Galaxy S24S23 series Google Pixel 8 series Apple Watch Ultra W PayPal,Hey folks Im looking to sell a bunch of newconditioned phone cases for various recent phone models What you see in the pictures is whats available Im also listing a Spigen Klasden Pouch for the Apple Vision Pro Ill cover the shippingTimestamp httpsimgurcomavFpK7mihttpsimgurcomavFpK7miPriced by brand will discount if you buy more than one Spigen 12 each 20 for two 25 for three Caseology 12 each 20 for two 25 for three Casetify 30 each 50 for two 60 for three Speck 15 each 25 for two 30 for three Nomad 25 each 35 for two 40 for three ESR for iPad AirPro 3060 each 75 for two 95 for three Pitaka 25 each 35 for two Mous 30 each UAG 20 eachMy inbox is open if you have any questions regarding which phone modelscase styles are available Thanks for looking,2024-07-23 02:26:15
Samsung WatchUltra with Pixel Phone,Anyone using Google Pixel phone with Samsung watch ultra I love the watch but not sure if I can make the full use of the expensive watchsamsungwatchultra,2024-10-10 15:27:58
Connecting Pixel Watch 3 to China Rom Phone,HiI just got the Oppo N5 running China ROM ColorOS 15 I wonder if theres a way to connect my Pixel Watch 3 to this new phone Pixel watch app crashed everytime I turn it on and Im already trying to pair the watch through bluetooth,2025-03-03 01:54:30
Pixel Watch 3 w Samsung phone,Ive done a bit of reading on other posts in this sub about features that dont work with Samsung phones It seems these are some of those features DND and bedtime sync  Remote camera Remote unlocking your phone when paired with your watchHas anyone tried side loading apps that can work around this Ive seen someone who sideloaded an app called DNDSync which fixed point one But that was posted in January about the pixel watch 2I really want to get the pixel watch 3 for the design and software much more refined than Samsung and for the accurate workout tracking,2024-11-15 19:05:03
News Weekly Pixel Watch 3 feature gets nod from FDA Slacks massive outage some Android phones get insane updates and more,,2025-03-01 12:02:15
Jogging with Pixel Watch 3 without the phone,Hi I have the Pixel Watch 3 45mm version LTE Spectrum doesnt offer LTE connection so I want to know if I can jog without my Pixel 9 Pro XL That is if my Pixel Watch 3 45mm will track my running and walk I dont know if Im clear Anyway I just want to know if the Fitbit app on my Pixel Watch 3 45mm will track my progress leaving my phone at homeThank you,2025-02-26 22:53:39
