post_title,self_text,time_frame
6 hours on holdchat drove to the store ATT not honoring Pixel Buds promotion,Wanted to share my absolutely ridiculous experienceI ordered the Pixel 9 XL on black friday including the free Pixel buds that come with a new pixel order I received an email requesting ID verification which I submitted immediately The next day my order still hadnt gone through I was concerned so I called customer support waited 2 hours twice and was disconnected both times I eventually got through and was reassured that ID review takes 24 hours not to worry it would be fineA few hours later my order was entirely cancelledThen I messaged customer support ref17331818419107798 with my concern At first I got the message do not worry Ill recreate the order itll be totally fine Only for the charge to be 230 higher than it should be customer support was attempting to charge me for the buds I caught this then customer support realized the mistake and pivoted to go to the physical store with your cancelled order theyll be able to honor the promotionorder I asked specifically if it would be an online order issue the feedback I got was No that will not be an issueSo I go to the store the next day Only to be told it was an online order only and they cannot honor it but not to worry Order the phone today call the customer loyalty department and they can honor the promotionSo the next day I call customer loyalty dept they say it is an online only promotion and they cant do anything about it The only thing they can do is point me aaaaaaaall the way back to online orderchat and see if they can do anything about it Ive gone full circle wasted 6 hours of my life and will probably just cancel my ATT line This is insane levels of customer mistreatment before I even have a phone in hand ,2024-12-04 15:48:55
1 month with Pixel 9 Pro XL coming from years of iphone ,A little bit of background My wife has a windows surface pro laptop refuses to use a mac but loves her iphone and refuses to use android again after the Samsung S22 and pixel 4 years We got two little children baby and one 5 year oldI heavily used iphones still have an iphone 15 pro max 512gb but recently got a pixel and LOVE IT More than the iphone Ive used pixel 3 4 6 7s in the past and didnt like it for various reasons My apple ecosystem apple tv fitness plus arcade disney macbook pro 16 late 2024 model mac studio with studio display and apple keyboard largest ipad pro from 2021 with the magic keyboard thing 2TB icloud drive Still have my old mecomhttpmecom email Airpod 4 and airpod pro Apple watch ultra I still use all of these from time to time My apple watch is super useful for workouts I buy movies on apple since we have ipads for travelingWork ecosystem No apple products in USA government job Only use windows related hardware and software Google ecosystem 2TB cloud drive and gemini advanced pro that came with the pixel Youtube premium that comes with youtube music Pixel 9 pro XL Rolex Batman mechanical watch Google Fi cell service Chrome browser as its more compatible with many features on websites and the auto translate is awesome So why did I switch The pixel seems to be more advanced and do more things than the iphone even in prior pixel years The hardware SUCKED compared to iphones in the past Now the pixel hardware is superb and the softwareAI features are an awesome start for our world into AI In other words I got bored of the iphone and switched to pixel which makes me more excited to use daily Would I switch back to iphone full time use one day Sure maybe But for now I got the best of both worlds as my iphone as my secondary phone and my pixel as my main phone I cant connect my phones to work stuff because of work policies but its ok iMessage I mainly use whatsapp RCS helps but whatsapp is my main messaging service My whole family i mean ENTIRE family has iphones I am the only one that now uses android mainly I get asked did you get my imessage I smile and tell them nope I use whatsapp now on my pixel Especially while in Europe whatsapp is heavily used I use to care about the blue bubble and being included in family chats but not anymore Plus imessage only allows 10 people in a group whereas whatsapp allows over 1k in a single group chat not like ill have that many family members in a group chatIf pixel had some sort of premium workout program like the apple fitness stuff then id be all in probably with pixel watch and buds  Now if i posted this in the ios or iphone subreddit Ill surely get hateful responses ,2024-12-31 07:12:17
Google Pixel 9 Pro XL from Google Store has been loststolen by delivery drivers No help from Google,I am posting here as a last resort as I have already tried to get support from Google through various channels  including their live chat telephone support Twitter support They just reiterate the same copypasted responses without actually understanding the issue I have also tried to DM PixelCommunity here on Reddit as well as opened a ticket on dmziggys Reddit Request form and also DMed him directly receiving no response from all of these channelsI have now turned to post here as I have seen others have had their issues resolved or rectified after posting here and following the subsequent exposure to their issues Seems Google does not care unless there is an outcryTo summarise what happened I ordered a the 9 Pro XL directly from Google Store with an estimated delivery date of 22nd August I have ordered the 6 Pro 7 Pro 8 Pro Buds Tablet etc all before with no issues When I received the delivery box it already had some damage to it Therefore I immediately took photos of the entire unboxing process and lo and behold the phone was not in the actual phone box and instead there had been additional tissue paper stuffed inside to fill the spaceI immediately went to Google support and have been battling with them over 3 weeks with over 20 emails sent from my end with very little response from them They are refusing to help and are basically claiming that DPD tracking shows the package is delivered which means the phone must be in there When I contact DPD they said their contract is with Google so any missing items I need to raise with Google and theyll have to rectifycorrectGoogle Store support both via email or telephone support is zero help and I am really feeling helpless now as its nearing 3 weeks and theyve ignored my past 4 emails sent to them over the past week Can somebody please assist or help what I should do from here as a UK customer I do not want to do a chargeback as I have EVERYTHING on my Google account so do not want to risk losing it allTLDR Phone stolenlost from inside delivery box images taken and sent to Google Zero assistance or support from Google store on all their support channels over the past 3 weeks Need advice on what do as a UK customer feeling extremely helpless,2024-09-15 21:56:09
Pixel 8 screen lifting,The right side of the this pixel 8 screen has started to lift Its only on the one side and seems to not have any performance issues no overheating screen functions fine and buttons work Unsure if this is a battery issue This phone is less than one year old just trying to figure out next steps Thanks for your time ,2024-12-07 05:19:09
Pixel 9 9P and XL black Friday deals are terrible ,I feel like a mug now I should have just bought the XL I wanted when they were handing them out with Pro buds 2 They reduced the prices of the phones by 100 but also reduced the value of tradeins by 100 No free Pro buds 2 also Im so pissed because I expected the deals to better considering they just handed out 30 discounts to some peopleNow Im thinking should I wait and see if the prices still drop unlikely or wait till after black Friday and see if the XL  Pro buds 2 is available again ,2024-11-12 08:00:17
Completely let down by Google their support and the Pixel Buds Pro 2,I received my PBP2 on Oct 1 and immediately after taking them out for a run noticed a clickingpopping sound with each step Contacted support who initiated a return that required a hold on my cardJust got the replacement and the exact same issue is occurring Tried different ear tips updated firmware reconnected all kinds of stuffGoogles current response over the phone was that they will not forward me to a supervisormanager nor would they put me in touch with the legal departmentTheir best solution is for me to initiate another replacement get another hold which I know is a hold but youre asking to hold onto 700 total for ONE pair of broken Pixel Buds and wait for another replacement that may or may not have this problemJust super disappointed,2024-10-08 18:27:33
Bluetooth connectivity issues on Pixel 9 Pro XL,Ive been using the pixel buds pro without problems for the past 2 weeks and now it has terrible range all of a sudden for some reason I have to hold the phone up to my face for it receive signal If I move it any further the sound cuts out and then eventually disconnects This is only happening with the Pixel the earbuds are fine Ive only seen a few other posts talk about having Bluetooth problems Im just wondering if its a hardware defect or a software bug Should I replace the phone,2024-09-07 12:12:08
Can I get a spare right but for my Pixel Buds A Series,Ive been using Pixel Buds A Series for last 3 years I bought it with my Pixel 4a I really love the sound signature but while travelling I dropped a right bud And by the time I noticed that it was missing it was too lateSo I was using the single left bud for quite some time last 34 months but suddenly my pixel 4a wont connect to the buds so I forgot the device and now it wont even show up in available devices in my pixel 4a And yes I have updated the pixel buds app and the phone is running on Android 13 and latest play system update Oct 2024 It connects to my laptop but wont connect to my PhoneIt would be really great if can get replacement bud rPixelCommunity,2024-11-01 19:20:26
Pixel 8 Pro left in 6 feet of water,I was out fishing today and managed to have my 2 month old pixel 8 pro fall out of my chest waders and fall into a river about 6 feet deep  I went shoulder deep to look for it but couldnt find it as it was night and I was going by feel of my hands and my bootsI was planning on going down with goggles and a flashlight tomorrow  around 12 hours after I initially dropped itIf I were to find it does anyone know the likelyhood of if itll work  I dropped it in a freshwater river approxomately 48 feet deepAny advise would be highly appreciated  Update  FOUND THE PHONE SIX FEET UNDERWATER  It was in the water for 16 hours by the time I found it and it was still turned on lol   I turned it off instantly but my Dad accidentally turned it back on and it stayed on Pretty sure all the water is out now as the speakers work perfectly fine and it charges fine Regardless thank you guys for all of your help and suggestions ,2024-09-14 02:38:15
pixel 8 pro was stolen what would you do now,hi folksmy flair is a lie now i am now dealing with a slow samsung s8 with cracks and no SIM cardanyways i am seeing the pixel 8 pro online for 700800 now is that price something that will further decrease the next months or is it fine heard in a thread that these arent even produced anymore cause the sales failed is that really truei also could wait for the 9 pro xl but the bigger expected price and the design i hate the leaks of the back idk are making me think if it is even worth it it seems like the only new features are AI things that do not arrive in the EU anyways so no big WOW for me what would you guess is the preorder bonustldr what would you do in this situation as a android and especially a google fanand if you wanna know how it happened or are interested in my life issuesi got stolen by a nice guy when i was working on a cityevent working in a marketing department i was sitting on a sunchair with my phone on my belly when suddently one of my companys tents flew away by the wind in the face of a woman i instantly rushed to her trying to help a few seconds later my mind realises that my phone is not with me anymore i look behind and the friendly guy runs away with it yeah my bad police was alarmed but werent able to do much more i already tried to talk to my boss bud sadly its not covered due it being an easy steal and included no breaking in or smth welp,2024-07-11 19:40:44
Pixel 8 Heating in High Temperatures  Any Tips,Hey everyone I got my Pixel 8 back in October 2024 and I live in India where temperatures are hitting 35C 95F and beyond Lately my phone feels warm sometimes even hotI mostly use it for watching content on YouTube Prime Video or Netflix usually with my Pixel Buds Series A Im always on WiFi but switch to mobile data occasionally for better receptionGiven the heat and my usage what can I do to keep my phone at a decent temperature Any tips or settings I should tweak,2025-03-24 06:45:44
Pixel Buds 2 Pro Eary impressions  comparison with Sony WF1000XM4,I preordered my Buds 2 Pro on Sept 1 and they arrived today Sydney Australia Early impressions and comparions with Sony WF1000XM4 below Note that I bought then immediately sent back the original Pixel Buds Pro when they were first released in favour of keeping the XM4s As others have said theyre very small and light Fit feels good Im not sure I have the right sized tips in yet Im just using the mediums so far but they definitely feel secure They dont move at all when I shake my head around The real test though is sweat Ill wear them on my walk tomorrow hopefully to test if the seal breaks continually Thats the usual problem I have with buds I pretty much solved it with Comply tips on the XM4s Oh and I tested eating with them in and they didnt move YMMV but great for me I could sleep in these but I have pretty big ears so they dont stick out on me  Slept in them last night All playback controls work every time play pause skip etc I REALLY like that the confirmation beep on skip track is slightly delayed On the XM4s its immediate and I often dont hear it because all I can hear is my tap This is compounded by the fact that the XM4s controls are much harder to hit cleanly so I often end up pausing single tap when Im trying to skip double tap Volume swipe works every time Tap and hold for assistant works every time Assistant is fast and helpful I believe its using my phones chosen assistant I prefer Google Assistant to Gemini still Slight issue the assistants voice MAY be a little too loud for my liking I havent tried reducing it yet and Im not sure I want to because itll probably be a good volume when Im most likely to use it while walking Sound quality is very good Hard to say if its better than the XM4s because I have both EQd But I like the PBP2 setup better than the setup Ive got going on the XM4 at the moment Its all a lot cleaner but still very prominent and clean bass The XM4s sound muddy by comparison I may be able to close that gap by adjusting my EQ but havent tried yet and probably wont Theyre not a patch on my 50 IEMs for sound quality but thats to be expected Eartip seal check didnt work Said there was too much noise even though I was sitting completely still in a quiet room Hearing wellness feature is cool I often worry I have the volume too high but it says Im OK  Thats at about 80dB Conversation detection isnt working out of the box Ive looked hard and theres no setting for it I Googled it and can see that other people have experienced this problem One guy said it magically appeared after a few hours so Ill keep checking back Apparently my firmware is up to date so Ill just have to wait  Yep the toggle setting just appeared after a few hours Weird And yep its good Kicks in in about 12 seconds Love the case Its better than the Pixel Buds A case and definitely better than the XM4 case With the XM4s I always seem to choose the wrong side to open the lid from It seems like a trivial thing I know but still Putting in and out of the case is easier than with the original Pixel Buds Pro Not yet easier than the XM4s but I suspect thats just a question of getting used to it  muscle memoryI cant think of anything else to mention but if you have any questions feel free to ask If I think of anything else later Ill edit my original postEDIT I believe ANC is significantly better than the original Buds Pro from memory They were nowhere near as good as the XM4s The Buds Pro 2 are actually better than the XM4s However its important to note that I have different tips on the XM4s now Back when I compared them to the original Pixel Buds Pro I was using the stock tips probably medium Im now using Comply tips size small So its possible the seal isnt quite as good The seal still FEELS as good and the bass is as good as I remember it being back then so I dont think theres a seal issue but you never know The box with the tips in it is very good Makes it easy to keep them separated My right ear is hurting a bit but I think thats because I tried the small tip in that ear for a while and I think they were jammed in further or a hard surface was pushing on my ear where it wasnt with the medium Ive switched back to the medium and will report back on this later Call quality is good I just had a 25 min phone call with my boss and he said he could hear me clearly He said it sounded like I was a bit further from the mic but also that that may be because he was outside a loud restaurant in the wind ie It may have been a problem at his end Ill report back on this too I cant get Gemini Live to work properly I can invoke it with the magic words but it cant seem to hear me after that I can use Google Assistant by pressing and holding my right bud though and thats fine for me Gemini will cost money after the first year  Actually I think this may be my own stupid fault I have a1 month free trial but I havent activated it so I suspect thats why its not working Im not interested in paying 30 per month for AI so I doubt Ill try it No sound leakage At least according to my wife Im listening at 80db lying next to her in bed and she said she cant hear it at allIm very interested to see how well it cancels wind noise when listening to media The XM4s do a good job of thatSUMMARY AFTER SEVERAL HOURS USE Theyre very good Ill be keeping them and will probably sell the XM4s Biggest reasons comfort fit touch controls case removing from case One word convenience So far theyre exactly what I need from a pair of buds like this Very good allrounders and everything is easy I wouldnt buy them for DEDICATED music listening ie sitting and listening with eyes closed but for listening while DOING theyre great Since buying IEMs I dont think Id ever buy TWS buds for dedicated listening although Ive not tried anything 500 but I suspect Ill end up listening to more music on these and more of each song simply because I can easily and comfortably listen while doing other stuff I havent had a chance to exercise in them yet but Im betting thatll be fineEDIT  I went for a good walk with these in this morning 1hr 40min of hard walking Sweated quite a bit Spent about 13 of the walk listening to an audiobook and about 23 on the phone They felt secure the whole time and pretty comfortable A slight discomfort but nothing terrible I didnt feel driven to adjust the fit the whole time When I did twist and push when I got home though the right one had lost its seal Also I noticed a rustling sound with every step I believe this was slight movement of the tips It wasnt a showstopper but its not something I hear with my XM4s and the Comply buds Ive now switched to a pair of Spinfit CP155 tips so see how they go Just sitting they feel a little more seated but I wont know for sure until I go for a walk tomorrow morning Ill report back then My phone call recipient was my boss and I talk to him a lot on my walks He said there was less wind noise on these than normal It felt nicerefreshing to not have the huge XM4s in my ears Not that the big body of those buds makes them uncomfortable for me but you still know theyre there eg You cant feel the movement of air on that part of your outer ear ANC wind noise management touch controls all worked fineEDIT The Spinfits are no good The buds dont charge in the case with them on and they made the same rustling noise I tried a pair of Symbio tips which are a hybrid with silicone outer and foam inner and they fit the buds fine didnt stop them charging although they seem to impede the magnet a little when dropping the buds into the case and they dont adversely affect the bass They also seem not to make the rustling noise as much But they reduced the effectiveness of the ANC so for now Ive switched back to the stock tipsFINAL EDITIve decided to send them back After wearing them for several hours today I began to find them fairly painful in my left ear Bummer Have ordered a pair of Sony Linkbuds S instead,2024-09-27 05:56:18
Pixel Buds Pro 2s  my first couple of hours,Hi allSo my pair arrived this morning and I already have a few thoughts on them  Please bear in mind these are just my opinions and Im not a pro reviewer or anythingFirstly wow these are so small and light  They make my airpod pro 2s feel big  They are really comfy to wear too Setting up on my Pixel was a doddle and there was an update already to the software to 2117 for buds and 155 for caseThe sound on them for me is excellent and I like them as much as my Airpod Pro 2s  I havent played with the EQ and probably wont to be honest because songs are recorded at so many different levels youll be constantly fiddling with it so I just leave it as is  Im also over fifty now so my hearing isnt top notchThe noise cancelling is excellent and I would say as good as my Airpod Pro 2s as well so far All of it feels really nicely made the earphones snap into the case nicely and I look forward to seeing what the battery life is likeNow for the problemsNow this is the first pair of Pixel Buds I have owned but the touch stuff is seriously problematic under certain situations for me so far  I took the dog out for a walk to test them and everything was great initially but then it started raining and suddenly everything went to shit  Even though we were quite dry in a wood sheltering my fingers became damp and the earphones stopped responding  The music just stopped and the only way to get it to play again was using my phoneThen when I put my hood up and starting jogging back the hood must have kept brushing the tips and starting and stopping the music and putting the noise cancelling on and off  Very annoying Especially in the rain with a dogAnyway once this happened it was like the earphones crashed  Putting them back in the case then taking them out again got them working properly again  So I dont know if this is a software glitch or not but Im not going back out into the rain too test then againAnother thing is knowing where to tap them  You cant see the side of your head so you when you go to pause them for instance you tend to be putting the volume up and down and jumping forwards and backwards a track  Im going to give them a while but this is really annoying for me at the moment  Airpods just work so much better in this regardAnyway these are just my initial thoughts after a few hours  Perhaps after some use Ill get better accustomed to the pads and how to use them  I hope so because theyre lovely and sound and cancelling are greatEDIT Forgot to mention the Gemini integration is working really well so far in the limited use I have made for itEDIT2 multipoint connection works really really well for meEDIT3 after saying all that about the multi point its stopped working  Nothing will play on my Pixel now  I had to put the buds back in the box shut down all my media apps shut my MacBook and reopen media apps on my Pixel to get it to work  Poor  Hopefully sorted with an update sometime in the future Sigh ,2024-09-26 11:02:16
Pixel Buds 2 pause after skipping in pocketcasts,Anyone else experience this Recently my pixel buds pro 2 have started to pause after skipping If I double tap it skips ahead 10 seconds and plays a second of audio and then pauses It does not do this with YouTube Music I have factory reset the buds and rebooted my phone same thing happens It did not do this a few weeks ago Im baffled,2025-01-15 21:58:00
Imagine its the year 2030 and Google has announced its latest flagship hardware products ie Pixel Phones Tablets Watches Earphones What features and specs do these products have and how different are they compared to now,Imagine its the year 2030 and Google has announced its latest flagship hardware projects ie Pixel Phones Tablets Watches What features and specs do these products have and how different are they compared to nowHere are some additional questions to encourage discussion1 How much have foldable technology advanced Are foldables truly ubqitious2 What might we expect in terms of wearables like glasses3 Has the Pixelbook returned If so how has it improved 4 How much has the form factor of the Pixel phone fundamentally changed 5 How much have the Pixel Buds changed,2025-02-16 09:08:16
Pixel buds pro 2 audio volume different between ears ,My buds have been acting really strange this past week If I have my volume low it sounds like the sound has been panned about 8020 leftright As I increase the volume this ratio smoothly shifts to be the exact opposite volume at 2080 leftrightI have factory rest my buds and restarted my phone Still happening Also sometimes the sound will lock at some volume level and I cant change volume even tho the slider appears and visually shows me loweringraising the volume They havent been physically damagedMy volume balance is set to equal Anyone else experienced thisEdit Report the issue in the pixel buds app if this is happening to you too hopefully Google can fix itDevice DetailsMore SettingsSend Feedback ,2024-12-21 05:42:22
