post_title,self_text,time_frame
Pixel 9 Pro Disappointment,I owned a Pixel 2 and loved it Compact and light Always on display now playing photo sphereit was incredible for its time However it eventually wore out and I was left with a choice between the Pixel 6 or a Samsung S22 I dont like phones the size of dinner plates so I went with the Samsung It was a great phone Fast forward to this year and TMobile had a great tradein offer for a Pixel 9 Pro so I figured I would cash in my S22 while I could still get a lot for it I wish I didnt and this is why1 The P9P is heavy The S22 was super light but now I feel like Im lifting a brick by comparison Perhaps thats the price to pay for a better battery which is admittedly quite good on the Pixel2  The Bluetooth is awful I have an older car 2007 with builtin Bluetooth for calls only This was before Android Auto Ive never had a problem with any device on it but the Bluetooth connection with the P9P on my car is very unstable It will cut off after about 30 seconds on a call Ive pairedunpaired reset BT cleared cache etc etc Nothing works and both the car and phone work perfectly with any other BT device3 The camera just isnt that special anymore I loved Photo Sphere but its gone Theres really nothing about the Pixel camera thats any better than the Samsung 4 The pure Android experience is a buggy disaster The Samsung UI was much easier to navigate Moreover Android will randomly change my phones language without me asking it to Ive seen this complaint from others on this forum as well5 Pixel support is a nightmare I can barely understand their thick accent and they just walk through the standard stuff and are generally unhelpful They wanted me to do a factory reset or take it to a repair center I dont think there is anything about this phone that is defective There just needs to be some kind of software fix   Sorry for the rant If anyone has any suggestions Id be grateful I really want to like this device but Im finding it difficult  ,2025-03-04 04:38:03
Pixel 4a forced my hand and I shouldve done it years ago,I had held off on Lineage as my 4a was fine I was ignoring the reboot to update popup and had auto update on reboot disabled so thought I had bested googles sinister plot to destroy my phone I couldnt really afford to update since I had to have certain apps working and couldnt be certain they would on Lineage also really not wanting to buy a new phone if they didnt since this one was otherwise 100 functional I accidentally hit update when the popup came out of nowhere while texting which I suspect was googles scheme all along So I installed Lineage with nothing to loseAwesome experience I loved how concise the instructions were with multiple extremely clear warnings Appropriate since theres a fairly significant chance youll brick your phone if you do the wrong thing No fault of Lineage and again I suspect google does this is some small part on purpose I think in a few places the instructions may have been a little TOO concise if I hadnt already known what a step meant from experience it wouldve had me on forums before going to the next step but overall very good A couple of takeaways Ive had from this All my core security apps worked as before to my surprise Banking flights government apps etc No root I wouldnt unless I had to This echoes a lot of other peoples experiences Ive read about A side effect of avoiding google where possible is the backup process was manual and tedious Very annoying trying to restore all my apps and configs I had a second android phone with a wrecked glass screen galaxy a11 that I duplicated everything to It was a good way to dry run my backups as well Probably wouldve been a breeze with root I imagine I had forgotten I had spacedesk installed on my computer this lets you use your phone as an external monitor including sound and touch Incredible app for lack of a better term it hijacks the driver in some way Confused the hell out of me for a good 20 minutes as it was deleted from my phone and the phone was still talking about spacedesk I thought it was malware I didnt want to progress without knowing the driver was acting like the install guide said it should I took screenshots of my installed apps as a backup Not realising you can use the play store  manage apps not installed to see everything youve ever installed and also batch install them I also didnt realise that installed apps often have different names to the official name on the app store which makes them hard to find again Worst of all I didnt realise some apps I use are no longer on the app store at all such as the great lithium epub reader I shouldve confirmed this beforehand and extracted the apks I dont really want to install from shady apk mirrorsedit  having separate wifimobile data button back is an incredible blessing as well as having the power button not held hostage to the google cameraOverall awesome though Ill be ordering a new battery once they come back in stock and will 100 be using this phone until either the Lineage team stop supporting it or I destroy it by accident There is no reason for phones to have the lifespans they are given by vendors if you dont play videogames or similar high intensity activity theres no reason a mid range shouldnt be able to last 10 years Playing media and using the internet thats it,2025-02-19 10:10:27
A better battery life guide for Pixel phones,Fellow brethren This is something that I did for eeking out the maximum battery on the Pixel without sacrificing any features in the previous guides Ive seen hereSwitching back to 60hz uninstalling social media apps etcSo Ive had the Pixel 8 for almost 2 months now The battery life when I received the phone was around 5hr SOT which got better after the adaptive battery kicked in 6hrs Now as the days passed I felt this itch to squeeze more out of the phone battery I got good reports of battery usage on the Android 15 beta so I switched over Now the SOT became 65hrs Not good enough Then I took the steps below and the phone gets around 8hrs SOT regularly Its also important to note that I never had any issues with my phone like call drops or shitty signal or random reboots etc I use internet and WiFi sparingly and the battery stats here are not just on WiFi Also bear in mind that Im on A15 beta The phone is flawless for me1 Use a really good battery monitor Pixel inline battery monitor is okay but its not great BetterBatteryStats is the king of all monitors But sadly it doesnt work on android 15   So I used two Accubattery and Gsam battery monitor Both are really good But Gsam has more data recording and visualization graphs for heat battery CPU usage and a lot more Also accubattery doesnt record how much battery the phone signal WiFi CPU android system Kernel etc use While Gsam records all those and wakelocks of your phone You can get the premium versions from Mobilism listed in the wiki of rpiracy which I think gives you some extra features You will need to grant Gsam some extra permissions with adb2 Install macrodroid and get the Enhance battery life V2 macro from the macro repository inside the app If you understand feel free to move on to the next one but  If you find the above sentence dense heres a breakdownMacrodroid is an app which executes macrosscripts that you install on the phone For example you can install a macro to turn on flashlight when you shake the phone or turn off WiFi if no networks are detected within 20 seconds etcNow there is a huge repository for macros inside the app itselfin the bottom panel and then search for it and the one that you want to install is called Enhance battery life V2 macro This enables battery saver when the phone is locked Locking it to 60hz and putting tasks into idle quicker Hence you get very low standby drain on the phone You might need to give macrodroid admin rights on the phone and enable androidpermissionsWRITESECURESETTINGS via adb Dont worry itll be given in the macro instructions what to do or a quick Google search will help you out Screenshot attached of how the macro should look like finally3 Using savetuner This is a FOSS app which changes how your batterysaver mode deals with applications You can set extreme savings to default settings in the app I set it to extreme and tweaked the settings a bit screenshot attached to get real time updates from apps but also put them into deep sleep otherwise Now this pairs very well with the macro above as your phone does the extreme saving when its locked The phone also doesnt kill apps in memory and I have retrieved an open YT video hours later at the same point from the recents menu 4 Use 4G I know this might be a deal breaker for some people but for me it works great I get the speeds I want from it the phone doesnt heat up and stays cool I also havent had any drops in signal or inability to receive calls etc Also my location is off mostly and Bluetooth is on most times connected with my watch5 Optional Using A15 beta Things are much much smoother The animations the performance of the phone etc If you do update clear the storage of Device health services app everytime you do it This will reset the adaptive battery and brightness stats For some reason this helps the battery life I also have now playing Ok Google and all the bells and whistles of the Pixel device on6 Debloat your Pixel phone Yes you heard me right Pixel OS is supposed to come with no bloat but it isnt There are codes and processes which are useless running all the time in the backgroundThere is an amazing FOSS app called Canta which helps your debloat your phone It has a tag called recommended which recommends the apps you can debloat They have been tested such that if you remove it nothing breaks It has a description of what the app does if you click on it so you can decide if you want to remove it Ive attached screenshots of the apps I kept on the phone out of the recommended bloat such that you dont lose any features If you accidentally uninstall any app that you want dont worry You can easily reinstall it anytime using the same app I dont use android auto or safety or pixel tips etc so you dont find them in the save list You can decide for yourself with the descriptions7 Use the 20  80 rule I charge my phone almost always in the range for maximum battery life I use battery to check the current battery health even though I doubt the accuracy My last phone Realme I ran it for 6 years with the same battery with this rule8 Using Icebox and disabling background usage Icebox is an app which disables any app that you select when you lock your phone My biggest standby drainers were InstagramSnapchat and Mull  a hardened version of Firefox Mull has been fixed now so Ive added Instagram and Snapchat to Icebox Now this will freeze the app like you disabled it so you wont be able to find in the app drawer when you unlock your phone No worries you can add a shortcut from icebox for any app you freeze so that you can open it after unlocking the screen Ive also disabled background usage for some apps like WhatsApp but this will result in you losing access to microphone if you minimize WhatsApp when during a call9 Things I wish could improve Video calling I do a lot of WhatsApp video calls and this eats battery like crazy I wish Google would improve the optimization of battery on video calls10 If you reached this far heres a BONUS tip If you have rooted your phone the Sultan Kernel for pixel 8 is an amazing option for battery and performance Ive heard reports of less heat battery consumption and snappier performance Hes doing what Google Devs should do and for the benefit of the community So check it out Thanks for listening I hope people can benefit from what I did so that you can enjoy your Pixel device Let me know if you have any questions,2024-06-18 09:58:05
Mative Linux on Google Pixel,Since today after a Software update there is a terminal app on my Pixel 7a I only had to activate it in the developer settingsSo far Ive only tested vim and the arm apt store were Ive downloaded neofetch Everything worked exactly as intended Of course its a bit awkward on a mobile phone keyboard but I believe this is a step for google towards a DesktopAndroid where you can connect an Android phone to a monitor and it automatically switches,2025-03-19 07:33:00
Pixel 8 Bluetooth pairing requests wont stop in car,Ive seen some posts on here about this issue but never a solution Basically our car that Ive previously connected to wont stop requesting to pair with my phone even when I hit unpair or forget device The car has android auto now so no reason to connect to Bluetooth It requests to pair every 30 seconds when Im driving it or even driving behind it in a different carI have Bluetooth scanning off and Ive tried resetting Bluetooth  WiFi This has happened with multiple cars so I know its a phone and not a car issue Any idea how to get it to stop Id rather not have to turn off Bluetooth every time I drive ,2025-03-20 17:58:22
If you lose access to your Pixel in Windows this will probably fix it,I fought this forever Lost ability to see my Samsung S9 and then my Pixel 8 which happened todayAn error you might see when you try to install or update the driver is A service installation section in this INF is invalid Or you might see this This device cannot start Code 10 I saw both repeatedly for around 6 hours today until I chanced upon this video which showed me how to fix the issueThis 4 minute video absolutely worked for me How to Fix a Service Installation section in this INF is invalidhttpswwwyoutubecomwatchvTSEvP89EesUabchannelPGBhttpswwwyoutubecomwatchvTSEvP89EesUabchannelPGBIn words on the phone he accesses USB Preferences He changes the setting from File TransferAndroid Auto mode to PTP Mode Immediately he had access but it was limited to pictures and videos He sets back to File TransferAndroid Auto mode then in Windows Device Manager under Other Devices select MTP Update Driver Browse my computer for drivers Let me pick from available drivers Select Android Device Click Next Select MTP USB Device Click Next Then youre done and you have both ways access to all file types and folders,2025-03-15 01:21:12
OnePlus Open or Pixel fold 2,Im real lost on what to pickI currently have a pixel 3 XL and this thing is getting really close to its death bed The battery has lost so much health the charging port has become extremely loose it struggles connecting to wifi and is generally showing its ageI want to upgrade soon and really want to upgrade to a foldable but I cant decide on whether to get the OnePlus open when it goes on sale or wait until the pixel fold 2 comes outThe OnePlus Open looks like an incredible device It has a great aspect ratio great battery great performance and its cheaper compared to the other devices especially considering its 512gbs but customer support and potentially buggy software give me pauseThe pixel fold 2 also looks really appealing It has the same great aspect ratio actually a little better since the inside screen is bigger Ill be familiar with the software since I currently use a pixel and as someone who likes to use phones until they die the 8 years of software updates Google has been pushing looks really nice Itll also be a newer gen device than the OPOBut we dont know anything about the price battery capacity and as someone who wants to start gaming on their phone with the big screen the tensor chips havent been giving me a lot of hope I also wasnt impressed by the first pixel fold It has weak performance battery life a bad hinge and a middling crease We dont know if the pixel fold 2 will fix thatNormally I would just wait until the pixel fold 2 comes out and pick but my current phone is really on its last legs and I dont know if it can survive until OctoberAny advice would be really appreciated,2024-07-10 16:52:05
No audio through Android Auto Pixel 9 Pro XL,Edit  SOLVED  uSquintz82 posted thishttpssupportgooglecomandroidautothread312020339noaudioviaandroidautoafterdecember2024featuredrophlen which lead me in the right direction of what to enable I use the feature for disabling your microphonecamera often and enabling it fixed the problem    For the past few months Ive had no audio when connecting my phone to Android Auto and Im completely out of ideas of what to try Ive tried it with multiple cars and the issues persists Other phones dont have this issue in the same cars Im using it via a cable and not bluetooth dont have access to a car which supports bluetooth AA so no way to test thatTested multiple cables with no difference Can get the actual AA screen to show up in the car with no problem its purely audio that does not work and its starting to become a real headache It seems to have happened around the time I updated to Android 15 so I figured Id wait to see if any updates fix it which it hasnt,2025-01-14 14:49:56
Love the Pixel 9 Pro BUT,HelloLove the Pixel 9 pro which I have love the watches which I dont have and love the earbuds which I dont have eitherThe problem is that calls will not come through on the Android AutoFound a workaround which worked then it stopped workingOn the verge of switching back to Samsung or iPhone Cannot tolerate this in the carBut for this issue I would completely invest myself in the Google ecosystemIt is the first time that Google has the potential to destroy Apple but this issue may thwart this possibility ,2024-12-04 10:48:31
Pixel watch 3 my opinion,Ive been using this watch for a month now and as a tech and sports enthusiast I want to share my opinion on a product that seems to have the potential to bridge the gap between smartwatches and sportwatches I say seems because as Ill explain it has some significant limitations that are hard to overlook for anyone serious about sports Strangely these issues are often not highlighted in other reviewsFor context Ive been using the Pixel Watch 2 for daily activities and a Garmin Forerunner for sports tracking  Smartwatch FeaturesWhen it comes to smartwatch functionality theres not much to criticize Compared to the Pixel Watch 2 the new model offers a larger screen even in the 41mm version which is always easy to read and a muchimproved battery life lasting up to 2 days without issuesAll apps run smoothly allowing you to do practically anything respond to WhatsApp messages handle calls with acceptable volume check emails and monitor health metrics If you own a Pixel phone there are added perks such as synchronization of modes eg rest do not disturb alarms and the ability to control your phones camera with a live preview on the watchSports FeaturesHeres where the problems start Google has heavily promoted its new running and structured training features now natively integrated into the Fitbit app These are essential for those aiming beyond casual jogging However during actual running sessions the watch becomes nearly unusable Instant pace The pace calculation is wildly inaccurate with constant nonsensical fluctuations Alwayson display Not all data updates in realtime Some require manually activating the screen which is frustrating if youve disabled wristraise activation Pace alerts When using structured training the pace alerts often incorrect due to bad calculations can drive you insane Battery life After just 50 minutes of running with GPS tracking and music playback the battery dropped from 80 to 30 This is embarrassingly short for a device meant to support sports activitiesFor strength training the experience isnt much better If you want to follow a routine and track weights and reps youll need a thirdparty app as Fitbit only tracks time and cardio activityOne last note about the Fitbit app while its welldesigned and provides plenty of data its frustrating that sleep tracking only shows a summary unless you subscribe to Fitbit Premium This limitation feels unreasonable  ConclusionIf youre looking for a smartwatch and dont have high expectations for sports tracking the Pixel Watch 3 might currently be the best Android option available However if like me youre seeking a device that can replace a dedicated sportwatch like Garmin youll be disappointed and will likely need to continue using two separate devices,2024-12-05 15:08:50
Why I returned the Pixel 9,I would like to share my experience and thoughts about the Pixel 9 including a comparison with the Galaxy S22I respect that its a good phone which might work great with others so the following are just my personal thoughts and why it didnt work out for me I wanted to replace my Galaxy S22 due to its quite poor battery life and after a lot of research I decided on the Pixel 9 due to its clean Android experience and for what was marketed as a compact AIdriven flagship After spending some time with it I decided to return it for several reasons 1 Camera The Pixel 9s camera can take decent photos but at this price point I expected more versatility I found myself missing the telephoto lens of the S22 which has been included in most flagship phones for years Another important omission is the lack of manual controls its an interesting choice to not allow adjustments for ISO or shutter speed Most phones include a manual mode so this was really disappointingOverall in auto mode I would say the Pixel 9 takes similar photos to the almost 3 generations back S22 about 90 of the time and better ones 10 of the time That would have been fine if it offered manual mode or a telephoto lens to complement its strengths2 Size weight and feel This was the dealbreaker for me Despite being marketed as a compact flagship this phone is anything but compact It feels like a brick in hand with flat thick sides that are made worse by the topheavy design caused by the massive camera bump This is far from a onehand device and coming from a genuinely compact phone in the S22 I couldnt ignore the size differenceWith a case on the phone becomes even more cumbersome On top of that the massive front camera hole is very distracting and I could never quite get used to it Its a shame because aside from these issues the phones design feels nice and premium3 AI The new Tensor chips AI capabilities were heavily promoted but they dont feel groundbreaking I was expecting on device AI with things like Gemini nano but as of now it only runs online Comparing the Pixel 9s AI capabilities to the S22 theres not much to gain For example the eraser tool to remove unwanted objects from photos which I use frequently works similarly on both phones That said I found the screenshots feature really helpful4 Inefficient CPU The efficiency of the Tensor chip was another disappointment Tests show that it consumes a lot more battery than the latest Snapdragon while performing the same tasks which is not good news for the longevity of the battery It feels like a larger battery had to be included to compensate for this inefficiency which contributes to the phones bulkiness However in terms of performance the phone runs smoothly and I didnt encounter any issues with the tasks I use it for5 Other things Even smaller features like the promoted weather app fell short The AI summary feature is a nice touch but the design feels uninspired and bland compared to others like the S22s weather app Overall considering the price of the Pixel 9 and the hardware it offers I dont think it justifies the premium costThe quest for a decent compact flagship continuesI hope the Pixel 10 gets things right with a compact release better hardware and a competitive price,2024-12-25 17:09:27
Understanding pixel passthrough charging,Hi everyone Hoping to get a little clarity regarding the pixel passthroughbypass charging feature introduced in the December update Ive read conflicting things and from my own experience with it Im left a little confused still so hoping this will help clear up some confusion on the new feature Couple questions I have1 The intention is for the battery to stop charging when it hits 80 and then it will be powered by USB or wall outlet power Does the battery dip below 80 and then constantly get recharged back to 80 This seems to be what Ive observed If this is the case does this do more harm to the battery2 I had my phone charged to above 80 this morning and then had it plugged in to my car using Android Auto and listening to podcasts The battery was not charging and was decreasing at a pretty normal rate Is this expected Why wouldnt the battery be bypassed completely and just use the power from the carAny insight would be greatly appreciated Thanks in advance,2024-12-19 13:35:30
What does the car icon at the top of my Pixel 9 Pro mean,Since yesterday theres a car icon at the top right corner of my Pixel 9 Pro and I cant see any way in Android Auto or Google Maps to turn this off The icon is just to the left of the WiFi icon and it wont go away even when I reboot This is my first Pixel and I never saw this icon on any of my previous Android phones What is this icon for and can I get rid of it ThankshttpsimgurcomabRnVZjR,2025-02-20 03:40:21
Pixel 9xl Missing Internet tile any way to get it back,,2024-11-27 17:42:08
Broken display  trying to save photos  Pixel 6a,Does anyone know if the USB preferences questions can be bypassed when connecting to PC Im just trying to save my photos I dropped my phone and the display broke so the screen is completely black Every time I connect to PC Im being prompted but obviously my screen is black and I cant click to select Please advise Thank you I connect to PC and then on the phone screen Im asking if Id like to file transferAndroid Auto USB tethering MIDI PTP etc I found a YouTube video where someone used an HDMI cable an HDMI hub and a wired mouse Please let me know if anyone has tried this on a Pixel 6a Thank you ,2025-02-21 12:23:19
