post_title,self_text,time_frame
USANY H Pixel 9 Pro Fold  Pixel Buds Pro 2  Pixel Case W PayPal local cash,Timestamp pichttpsiimgurcomRc682AgjpegAlbum of picshttpsimgurcomaERzm2D4Selling my Pixel 9 Pro Fold in Obsidian Black This was purchased through Verizon but is unlocked to use with any carrier Its the 256GB versionWith the phone Ill include the original box Google Pixel Buds Pro 2 in white and the Pixel 9 Pro Fold case in whiteThe phone itself is in pretty good condition The screens are pristine with the outer screen having a ZAGG screen protector installed on day 1 The inside has some pin sized dents on the both sides of the frame  I dont know how it happened since I barely ever used the inner screen and have been meticulous with it There is no damage to the inner screen but the frame has those little dents It never bothered me and I actually didnt even notice until my wife pointed it out to meSelling because I hardly ever unfold the phone and its difficult justifying the phone if such is the caseAsking for 950 shipped to anywhere in the ConUS 920 if paid via cash locally I am located in 10801 and will meet up anywhere that is reasonably distanced between the two of us I will ship via UPSFedEx fully insured and with signature confirmation being required so as to avoid any issuesSold,2025-03-20 20:40:45
Pixel Buds Pro 2 issues seriously sad first impressions,These are expensive headphones Ive been very pleased with my Pixel Buds ASeries so I had high hopesUnfortunately this has been my experienceThe headphones connected to my phone Pixel 9 Pro but had no audio no matter what I did Why should I need to do anything is beyond me successfully pairing headphones should allow me to hear things from the connected devicerightI then tried to pair to a second device The headphones connected to my work laptop Windows 11 and I could hear audio but the microphoneinput did not show up in any apps even after restartsreboots and is separate unlike how ASeries worked flawlessly as a single device  I cant attach a screenshot for some reason here but unlike my ASeries that shows as a single audio device Connected mic audio and works in all the apps in the OS the pixel buds pro 2 show as two separate audio devices one Audio and one Input but the input device even when showing as connected which all too often its not even showing in my devices in Settings its only showing the one Audio device but even when it shows the Input device as well no matter what I cannot use it in any apps ughI cannot initiate the Bluetooth connection from my phone to steal it from an already connected link with my laptop something that works as expected with my ASeries if I click connect from another device I have paired with in the past it will switch over the pixel buds pro 2 start to flip out and then are not connected to anything but continually tries to connect to the previous device all I hear is disconnectionconnection blips but then nothing worksAfter many disconnects and fiddling the audio started working from my pixel phone but how in the world did this not work from the very first second I connected Headphones  expected audio output is priority 1This is insane do you not even care to test Im trying this stuff with Pixel 9 Pro your own phone even   sad,2024-09-27 16:20:36
Pixel buds pro 2 Vs Samsung buds pro3,Guys I need some real help here I know we all in this forum have pixel phones  so I theory we should use pixel buds but the issue is that the Samsung ara half the price here where I live I would lose the Gemini things in the buds but I would use better coddecs with Samsung budsAny of you has or used the Samsung pro 3 or can give me some ideas what to do Thank you for the help,2025-02-20 11:05:40
Would it be worth moving from the Pixel buds pro to the Galaxy buds 3 pro,Hey yall so back in the summer of 2024 I switched from the pixel 7 pro to the S24 ultra mainly due to having a job that I was doing outside most of the time and anyone who is even a little bit techy knows was an issue with the pixel phones and Tensor up until the 9 series So rather than wait and potentially cause harm to my device with it overheating by just using it normally and the fact my phone was almost dead by 5pm most days I moved back to Samsung with the S24 ultra I then exchanged my Pixel watch 2 for a Galaxy watch 7 since Samsung was offering a huge trade in benefit for my ancient Galaxy watch 3 and I only paid like 100 for it and then gave my pixel watch 2 to my dad Fast forward to today I have a Galaxy book 5 pro 14 inch as well I just got to replace my Asus gaming laptop I almost never actually play games on that I mostly use for light browsing Reddit and occasionally bringing it to work to do stuff there I still have my Pixel buds pro as basically the last of my nonSamsung devices it worth swapping those for the Galaxy bud 3 pros,2025-02-23 16:05:46
What are the best earbuds for the Pixel 9XL,I just upgraded from the Pixel Buds pro to the pro 2 and I hat the fit I cant get a good seal at all with any size that came with it Anyone have any experience with the Galaxy buds on a Pixel phone Any other recs,2025-02-28 19:40:10
Very happy with Pixel Buds Pro 1  2 upgrade,My Buds Pro 2 Arrived today theyre excellentFor context Ive never used Airpods or other expensive earbuds only PBP1 ASeries and some cheap Anker ones as well as various over ear headphonesPros Super comfortable I was never able to wear PBP1 for more than 45 minutes or so without ear strain These are much much better Id say they are just as comfortable as the Aseries buds I was never not once able to pass the ear seal check on the old Buds Pro I ordered the foam tips and everything On PBP2 it passed first try They connect to the phone way faster The Case to Playing time is probably about 2 seconds now down from 67 seconds before You can turn on ANC while wearing only 1 earbud now which you couldnt do on PBP1 The transparency mode is incredible They advertise how much better the ANC is it is definitely better but I wasnt blown away but the Transparency mode is the real winner here Limited testing so far but conversation mode actually works now Was janky as hell on PBP1Cons Sound quality seems identical Honestly the bass is a bit worse but that can be compensated for with the EQ I wish there were better color options I guess Im a pink earbuds wearer now ,2024-09-28 23:50:40
Pondering upgrading to pixel 9 pro xl,I got a z fold 5 and can upgrade next month I love android but I do not want a folding phone anymore Im pondering upgrading to a galaxy s25 ultra or a pixel 9 pro I had a pixel a few years ago and loved the pure vanilla experience but also want the galaxy s25 because I have galaxy watch and buds How would the pixel work with the galaxy watch and galaxy buds Is the camera on the pixel 9 pro better than s25 ultra,2025-03-26 10:33:23
Update  pixel 2 to pixel 8 pro,Well I pulled the trigger I had my pixel 2 since early 2018 Yes we had a funeral and said our good byes Im gonna miss free unlimited photos but I have a pixel 1 for that issue I was looking at pixel 9 pro but the pice was too crazy Instead I bought a pixel 8 pro bay with 512gb I got this for 260  bought the watch for 80 and the pixel buds for 46 dollars  Not a bad set up I took your advice and got a case I also got a camera protector  since my iPhones lenses blew out  and I bought a screen protector  Not gonna lie its a massive jump with pro controls and high res mode Im excited to try out material U and video boost Thanks for your advice and if anyone has suggestions for settings Im all ears Sorry for mobile formattingTLDR I finally upgraded from pixel 2 to pixel 8 pro ,2024-11-21 14:13:38
Pixel purchase Google store best bang for your buck maybe,I posted about my coupon earlier and its no longer available but if youre going to Google store for the best trade in you can then go to Google store support and ask for a price match from Best Buy as they are at 250 off vs 150 Thanks to ujustyoursimplename  I forgot I did this on the buds a few years agoAlso dont forget Google One upgraded sub can get you a 10 store credit that shows up 30 days after your item ships Small print looked like it said only 1 year before it expires though Edit everyone saying the credit shows up right when it ships  My first phone I bought yesterday showed shipped status today and the credit was applied to my account shortly after just ordered 1st set of buds pro 2 with itEdit two  I bought the second phone today and went to this link httpssupportgooglecomstoreanswer9631873hlenI submitted my order number and the link to the Bestbuy website 75 hours after ordering and requesting the price match I received the email belowThank you for contacting Google Store support Google Store offers a price protection policy that allows customers to receive a refund of the difference if they find a lower price for the same product from a qualified retailer within the standard return period  Please note that price protection applies when the product is purchased directly from the Google Store We can process the price protection once your order has shipped provided the promotional deal from the thirdparty retailer is still active at the time of your request We have reviewed the link you provided and it appears to be eligible for price protection Please keep in mind the following conditions for the price protection  The retailer must be located in the same country or region  The product must be the same model color and memory  The lower price must be publicly advertised  The price match request must be made within the standard return period  Price protection is typically processed when the order ships  Once we have this information we can proceed with your request  For more information about our price protection policy you may visit this page Google Store Help  Please do not hesitate to contact us back if you have any more questions You can contact us on this email or contact us over chat or call through supportgooglecom Were here to support you 247  Your time and patience is highly appreciatedThanksAlexThe Google Support Team,2024-11-29 17:56:42
USAIL H Samsung galaxy s 24 ultra Google pixel 9 pro fold Apple AirPods Pro 2nd gen W PayPal local cash,Hi Im looking to sell my unlocked s24 ultra unlocked pixel 9 pro fold and airpods pro 2 The s24 ultra is running ONE UI 7 and is in great condition Theres one scratch on the back but its hard to see unless its in the right light Its the 256gb storage Looking for 750 715 shipped obo Pixel 9 pro fold is in alright condition Its straight from google Its got some scratches on the front and back The inside display is perfect The plastic has a scratch in it Phone and hinge function wonderfully Also has google preferred care which can transfer to you So if anything happens to the phone youre covered and can get it repaired Or if you dont want the current condition you can also get it replaced with the preferred care Looking for 1100 1035 shipped oboAirpods pro 2nd Gen are in great condition They are lightning I have the OnePlus buds pro 3 now that came with my OnePlus 13 so I no longer need these Looking for 100 shipped obotimestamphttpsimgurcomaLjOUDm7 Local 61701Repairs NAPlease comment before pm Thanks ,2025-03-01 16:13:54
LC3 support by Pixel Buds Pro 2,I got my Buds Pro 2 recently  I wanna know about LC3 commonly known as LE Audio supportThing is I got these phones mainly for their LC3 support yet after half an hour of things not working 50 of the time I turned BLE Audio off in headphone settings Guess theres no way back for me,2025-03-20 21:33:50
Apple to Pixel  First Time Pixel Owner,I am sure I am not the first person to post this but just joined today and wanted to introduce myself  My name is Stephen I am 24 and I am from Tennessee Lifelong Apple fanboy and user for over 10 years I was so invested into the ecosystem but I finally just realized that when the iPhone 16 dropped they werent doing anything new I mean they still had 60hz screens which is insane in 2024 I used to have this view that all Androids sucked and were poor in terms of user experience and what not   As of September 2024 I have officially sold my MacBook Pro iPad and apple watch ultra I have now swapped to a Pixel 9 Pro XL in Obsidian I will say I love this phone It feels like what most YTers call the iPhone of Android so I love this I even got the Pixel Watch 3 45mm and the Pixel Buds Pro 1 I love all of these They are incredible and my inner nerd and tech fanboy is enjoying this new way of using tech If curious I sold the macbook pro for a surface laptop 7 with the snapdragon Elite X processor in black   I appreciate you all taking the time to read my post and welcome me to the community I am loving my Pixel 9 Pro XL and am considering going to a Pixel fold next as I get an upgrade evert 12 months thanks to TMobile If you all have any tips or tricks or designs I should do to the setup let me know I am open to everything,2024-12-24 01:17:39
Pixel Buds are Awful and Google doesnt care,I had the first Pixel Buds in Mint Green And had to RMA them multiple times Then the warranty ran out and Id have to buy a loose Right or Left earbud from Ebay Eventually every Pixel Bud of that generation I had failed saved for one lone ear budSo I came here searching for reviews on the Pixel Buds Pro 2s And this subreddit is just full of the same exact posts from previous generations factory resetting and RMAs Disappointing considering I have a pixel phone and want to give them my money After being scornes by them and reading here Ill be buying something else Absurd to be paying 200 for something that will be broken on arrival or for something that will die possibly outside of an RMA window,2025-02-20 22:36:15
USACAH Google Pixel 9 Pro Fold Google Pixel Buds Pro Google Pixel Buds A Google Pixel Buds and Bose QuietComfort headphones the new ones with USB C W Local cash PayPal,Asking prices are listed below and buyer pays for PayPal GS If someone wants to bundle all or most of this up we can definitely work out a discountGoogle Pixel 9 Pro Fold 1000  timestamphttpsimgurcomaABlhNNdBose QuietComfort headphones 180  timestamphttpsimgurcomaig9os7GGoogle Pixel Buds Pro 75  timestamphttpsimgurcomag0AD8q6Google Pixel Buds 25 if bundled otherwise 40  timestamphttpsimgurcomaVWjjoGgGoogle Pixel Buds A 20 if bundled otherwise 40  timestamphttpsimgurcomaeUWqnAyI am selling because I purchased an iphone and other apple products RIP my wallet and am going to try that out for a while Note that everything is in good condition both functionally and cosmetically The only exception is the Google Pixel Buds the white ones have a small scratch on the side of the case pictured in one of their timestamp photosPlease leave a comment before you DM thank youEdit fix two dollar signs next to the bose priceEdit 2 fix the timestamp photos for the phoneEdit 3 Price dropEdit 4 Final price dropEdit 5 sold the phone locally,2025-02-06 23:57:15
Pixel Buds are the worst product Ive ever owned,It might be my fault for sticking to the original Pixel Buds the ones that came before the Buds A and the Buds Pro but hey it was early 2021 Google only sold these and there was no announcement of new earbuds from them reviews werent TOO bad so I went for itAnd oh boy was it the worst experience Ive ever had from start to finishIt started with having to replace them for literally 4 times as they always kept disconnecting from my phone and didnt want to reconnect until kept in the case for 510 minutes Also every single one of them always had some degree of case defect as the lid didnt align to the rest of the case making an awful sound when closing Hey at least the last pair of earbuds seemed decent enough on this regard and only disconnected once every 1020 days it wasnt too bad after all Well unfortunately issues didnt end there Because of course how did I not think that they could have disparity issues Like they constantly and consistently dispaired making the left earbud play sound first and then came the right one And the only way to fix this was to stop any audio coming from them wait for a couple of seconds and then play again Oh also did I mention that they have ALWAYS had a kind of background noise when anything was playing It was horrible silence apparently cannot exist with them Pixel Buds Anyways issues persisted all the time Ive owned them and recently new ones started appearing such as the right earbud only lasting literally A QUARTER of the time the left one does Well this of course only happens when Im just listening to anything because when Im in a call they only last 1520 minutes And last but not least some of these buds sometimes think theyre charging when theyre actually not and sometimes they think the case is open while its actually notBefore anyone says anything yes Ive contacted multiple times Google support even with Google One and they always had the same troubleshooting process charge them and factory reset them Needless to say this didnt work everAnyways yes this looks like a rant and it probably is These Pixel Buds are the reason I will never again buy any more buds from Google they have absolutely awful support and theyre terrible on every aspect Ive also never owned any other wireless earbuds before so I cant even say theyre terrible compared to X No theyre terrible period All this for an even more awful price tag of 200  Thats disgusting And no Im not trying to boycott Google I own a Pixel phone and a Pixel Watch and theyre great Great price not so much for the watch but if we compare it to Apples and great functionalities But come on is this really all they can do with some earbudsI hope they fixed these issues on their newer buds but in the meantime I hope to have warned any potential Pixel Buds buyer You might have a terrible experience Thanks for reading,2024-06-04 11:59:37
Pixel Buds Pro 2 Distortion when loud,Hey all Im having a weird issue with my new Pixel Buds Pro 2 This seems to only happen on my Pixel 9 Pro XL and combined with YouTube Music however I think the latter is only cause it plays louder than other apps Ive tested When listening to some music at max volume the sound will go like underwater for a few seconds before returning to normal I can reproduce this every time at the exact same point in the exact same song at max volume  If I pair my airpods to the Pixel this doesnt happen at all testing with the same songs in Youtube Music Equally if I pair my Pixel Buds with my Mac or Windows PC and play the same song at max volume it also doesnt happen Also Ive tried the normal YouTube app and the Android Apple Music app with the same songs and this doesnt happen either however Ive noticed that they sound slightly quieter than YouTube Music on the Pixel This also doesnt happen if I turn the volume down a bit with YouTube MusicI havent modified anything to do with volume its all as default Ive also noticed that if I turn off ANC this does not happen on YouTube Music either It seems to be purely YouTube Music on the Pixel at max volume with the Pixel Buds Pro 2 but Im thinking Youtube Music isnt the issue it just seems to play louder than any other source which is causing the issue Has anyone else had this issue,2025-02-17 22:09:01
Pixel 9 nonPro cant wirelessly charge with any case on it,Add me to the me too list for Pixel 9 Qi issues I know the articles floating around are focusing on the Pro XL but my nonPro Pixel 9 seems to have the issue as well1 Ive tried a few Magsafe charges with two different cases and none of them work They all show charging for about 10 seconds then show no charging Very reliably2 Ive grabbed a couple nonmagsafe Qi chargers that I bought from the Google Store the Pixel Stand 1 and the iottie dock has a second Qi charger for ear buds Neither of these will charge with any case on They both charge successfully with no case on the phoneIll be getting a Fold and a miniPro in next week Ill do more testing with those phones once theyre here I hope this is something Google can fix with a software update This is disappointingOn a side note In the process I created this overlay to figure out where the Qi coil is relative to the G Theyre pretty well aligned with each otherhttpsimgurcomgallerypixel9nonproqicoilalignmentHU6xDj7httpsimgurcomgallerypixel9nonproqicoilalignmentHU6xDj7,2024-08-29 16:42:48
Anyone use AirPods with Pixel phones,Anyone use AirPods with Pixel phones Work ok I know you wont get all Apple features on an Android but what is missing and do they work fineIm thinking as Ive had AirPods in past and prefer them to buds that shove inside ear I prefer the AirPod type just rests in The new AirPod 4 has ANC now with same type of resting in ear otherwise I would be looking at Google Buds pro 2 imagine have better integration with Pixel phone but think they are the shove in ear type ,2024-09-19 12:44:20
Pixel buds pro cant get a replacement ,Well I dont think Ill be buying the pro model anymore The first ones were bad then I got the 2022 pros because of a discount They lasted over a year but I cant get a replacement now for the right ear bud Im guessing because they now sell the buds pro 2 They still work if I turn the anc and transparency off but the right earbud is lower volume They screech if i dont I enjoyed them while they worked Ill say but the lower volume on the right isnt a good experience ,2025-01-07 21:07:45
Xreal One   compatible with Pixel 6 and Bluetooth Ear buds,I have a pixel 6 and would love an Xreal but concerned about compatibility with my Pixel 6 and the Pixel line in general Im also considering upgrading to the Pixel Fold so have similar concerns My primary use case for the Xreal is traveling on long international flights so being able to use Bluetooth earbuds with ANC is important as well If I need the Beam Pro to make it work properly that would probably make it a tough purchase for me Love to hear thoughts from others Thanks,2025-01-23 17:15:17
Pixel Buds 2 Early Impressions and why they might be going back,Just got my Buds 2 today and heres the quick and dirtyThe Good Fit These things are comfy Coming from AirPods Pro 2s I was worried but no pain even after hours of use Major improvement over the original Pixel Buds Transparency Mode So much better Almost on par with AirPods Pro 2s Sound A bit more bass but not a huge leap forwardThe Bad Call Quality The main reason I upgraded and its a letdown Sounds muffled almost like AirPods on an Android phone a bit of an exaggeration but you get the idea ANC Still not great AirPods are still the kings hereOverallIll give em a week but Im leaning towards a return The call quality is just a dealbreaker for mePS I made a quick video comparing the mics if anyones interestedhttpswwwyoutubecomwatchvU8YO3arqvcEhttpswwwyoutubecomwatchvU8YO3arqvcE,2024-09-30 21:11:43
Launch Pixel 8 Pro is Still a Beast,Been seeing another uptick of poor experiences with the new Pixel hardware so wanted to throw in my positive experiences to mix things up This is NOT me minimizing those anecdotes or claiming anyone who has had issues is lying I am merely doing this to verify the concept of silicon lotteryPreOrdered the Pixel 8 Pro through my carrier it was 600 OFF before tradein and I effectively got it for about 150 after handing in my Pixel 7 In the first month or so I dumbassedly started tinkering w it before paying it off and ended up bricking it trying to install a Beta build Google warranty replaced it no questions asked in about a 3day turnaroundSince late October Ive been using the Unlocked replacement 8 Pro from Google alongside the Pixel Watch 2 and Pixel Buds Pro and I want for virtually nothing Having compared it to the Galaxy S24 and iPhone 15 Pro I find the way Pixel hardware marriages together to be just as fluid if not more so in certain areas than Apple Ive tried my hand at AirPods and an iPad I largely prefer the way Pixel plays nicely with my Tab S9 Ultra S Pen brings everything together Samsung is probably the most logical alternative for Android users at the moment I found the Galaxy a breeze to use but missing Pixel exclusivesAll in all silicon lottery My replacement was mandatory as the software bricking compromised the initial model so this isnt even technically the launch Pixel but it was a brand new model they sent and not refurbished so I consider it part of the launch batch Even while tinkering I have had zero heating issues lag or general bugs I can think of Kind of strangeJust putting here in case anyone is thinking of the Pixel ecosystem It works and it works damn well I enjoy seeing Google answer the efficiency concerns with each passing iteration I do still think they could do more as a trilliondollar company to speed things up but Im also not a giant tech conglomerate On mine and many others in my friendfamily circles end Pixel comes highly recommended here,2024-05-14 17:45:52
Pixel Buds Pro 2 connectingdisconnectingconnecting rapidly,My Pixel Buds Pro 2 just a few months old were working fine but began to act weirdly not so long ago Happens not constantly but by my impression more and more often When I take them out of the charging case and put them into my ears they connect disconnect connect disconnect roughly every second Ding dong ding dong quite annoying Stops occasionally if I put them back in the case and take them out or if I let them outside the case for a while  In parallel sometimes the touch commands on the right one playpause volume dont workPhones a Pixel 8 Pro running Android 16 latest beta  but I was always running on beta versions so far never an issue Buds are updated to the latest firmwareDoes anyone have a similar experience,2025-03-20 11:00:42
