"sentiment","user_review","summary","time_frame","Issue Category"
"neutral","Android 15 could let your Pixel Watch control your phones media output.nan"," Android 15 may enable Pixel Watch to manage phone's media output.","2024-04-29 19:49:12","Android Auto Issues"
"neutral","Google Pixel Watch 5 might be getting a custom Tensor chip  After five generations of Tensorbased phones Google might also be putting a custom chip in its smartwatches.nan"," Google Pixel Watch 5 may feature a custom Tensor chip.","2024-10-28 13:05:18","Bluetooth Issues"
"neutral","My pixel watch 3 doesnt send text messages if I turn off my phone completely even though Im paying for LTE .nan"," The Pixel Watch 3 doesn't send texts when the connected phone is fully turned off despite having an LTE plan.","2024-12-23 04:35:45","Notification issues"
"neutral","Can Pixel Watch 3 be used with a Samsung Galaxy Phone.I am looking into buying a Pixel watch 3 but I own a Samsung Galaxy s23 Ultra phone Would I have access to all the features of the watch I am not going to be upgrading my phone for at least another couple of years so buying a Pixel phone is not an option for me I will one day be a Pixel Phone owner but not at this moment"," Can Pixel Watch 3 work with Samsung Galaxy S23 Ultra phone?","2025-01-22 16:11:09","App difficult to use"
"neutral","Pixel watch 3 disconnect from the phone .Has anybody experience the watch disconnecting and asking you to reset it  "," The Pixel Watch 3 intermittently loses connection with paired phones, resulting in a need for resets.","2024-09-18 17:26:47","Android Auto Issues"
"neutral","Cant Activate Pixel Watch 3 LTE with BYOD Verizon Phone.As the title says I have a Pixel 7 Pro that I brought to Verizon I purchased a Pixel Watch 3 from a Verizon store and they said I should be able to activate it in the app As soon as I get to the point where it tries to download the eSIM on the phone I am told that my device is unsupported because it is not a Verizon wireless retail deviceI have called Verizon support and spent a few hours on the phone with them but I was told it was not possible to do with a BYOD device They even attempted to manually activate it but the problem is the phone cant download the eSIM to send over to the watch and it doesnt seem that the watch is capable of doing so itself Has anybody had any experience getting this to work"," The Pixel 7 Pro cannot activate the Verizon LTE on a BYOD (Bring Your Own Device) purchased Pixel Watch 3 due to compatibility issues with downloading the eSIM.","2025-03-13 21:23:31","App difficult to use"
"neutral","Does Ultra Wide Band in the Pixel Watch 3 work with other brand phones.I just want to know if Ultra Wide Band phone unlock in the Pixel Watch 3 works with other brand smartphones"," The Ultra Wide Band phone unlock feature in the Pixel Watch 3 is compatible with other brand smartphones.","2025-02-23 09:39:38","Bluetooth Issues"
"neutral","Oneplus 2 and Pixel 9 Pro  how to get the phone to not default to the watch when a call comes in.Title says it all I cant figure out how to get my phone to not default to the watch when calls come in And the 0health app is disconnected and I cant find the watch to reconnect it"," How to prevent OnePlus 2 and Pixel 9 Pro phones from defaulting to the watch during incoming calls, and re-establishing connection with the Health app for the watch.","2025-03-28 18:12:26","Android Auto Issues"
"neutral","Can the Whatsapp App on the Pixel Watch receive and make calls when not connected to phone and is on Cellular .nan"," The question pertains to the ability of the WhatsApp app on the Pixel Watch to place and receive calls over cellular data without being connected to a phone.","2025-03-14 00:59:04","App difficult to use"
"neutral","Pixel Watch to Motorola Phone.I am considering getting a Pixel watch Two questions1 Does it communicate with a Motorola phone android OSand2 Does the Pixel watch have fall detectionThanks"," Does the Pixel Watch support communication with Motorola phones running Android OS and offer fall detection?","2025-02-09 17:03:28","App difficult to use"
"neutral","Do I need to have an eSIM on my phone to use LTE eSIM on my Pixel Watch 3.Hi I just bought a Google Pixel Watch 3 with LTE and cant set up an eSIM for it On my phone I have a physical SIM and I was wondering if that could be the reason"," To set up LTE on your Google Pixel Watch 3, you may need to activate an eSIM in addition to your existing physical SIM.","2025-01-18 08:16:54","App difficult to use"
"neutral","Samsung WatchUltra with Pixel Phone.Anyone using Google Pixel phone with Samsung watch ultra I love the watch but not sure if I can make the full use of the expensive watchsamsungwatchultra"," The compatibility of Google Pixel phones with Samsung Watch Ultra's advanced features is uncertain, potentially limiting the utilization of its premium capabilities.","2024-10-10 15:27:58","App difficult to use"
"neutral","Connecting Pixel Watch 3 to China Rom Phone.HiI just got the Oppo N5 running China ROM ColorOS 15 I wonder if theres a way to connect my Pixel Watch 3 to this new phone Pixel watch app crashed everytime I turn it on and Im already trying to pair the watch through bluetooth"," unable to connect Pixel Watch 3 to Oppo N5 running China ROM due to incompatibility with current version of Pixel watch app.","2025-03-03 01:54:30","Bluetooth Issues"
"neutral","Its very annoying that you can connect my Google pixel watch 2 to my iPhone.I just got the new google pixel watch 2 and I cant connect it to an apple device but Im stuck on the set up part of the watchPlease someone help me  and reply with info of how to fix it without using the merge app"," Google Pixel Watch 2 cannot be directly paired with an iPhone.","2024-12-25 04:40:20","App difficult to use"
"neutral","Can the pixel watch replace a phone .Alright the answer is clearly no However Im used to go running with my pixel phone and Im looking to see if I could use the watch to replace the phone and save some spaceweight Can I do all the following without a phone nearby calls calls via Whatsapp  share location via Google maps pay via NFC  stream music to a BT headphone get at least 34 hours of battery coverage If yes are there any catchesIm not interested in the training capabilities Ill use my Garmin for itAnd lastly are there any covers that can replace the watch bands Im basically looking to use this as a Tamagotchi while running "," Can the Pixel Watch support calls via WhatsApp, share location via Google Maps, NFC payments, stream music to Bluetooth headphones, provide at least 34 hours of battery life, and have replaceable watch bands, while not offering training capabilities like a Garmin?","2024-11-19 12:50:50","Voice Commands"
"neutral","Dexcom 7 monitoring on Pixel 7 phone and Pixel Watch 2 via Gluroo app.nan"," The Glucoo app enables Dexcom 7 monitoring on both the Pixel 7 phone and Pixel Watch 2.","2024-12-23 21:47:45","App difficult to use"
"neutral","Sync issue with Pixel Watch and FitBit Pixel 8 phone.Have you ever have this issue  Phone pixel 8Pixel Watch V1Fitbit App premiumI do have different step count on watch 12K vs app phone 8k  ","12K steps discrepancy between Pixel Watch V1, Fitbit app (Premium) on Pixel 8 phone.","2025-02-05 19:42:55","Sync issues"
"neutral","Why cant a pixel watch connect to mobile data without being connected to a phone.It would make sense if you could only use it with a Google phone Thats not the case Sois there technical requirement"," A Pixel Watch cannot directly connect to mobile data without being tethered to a compatible device.","2024-11-20 18:46:13","App difficult to use"
"neutral","Garmin watches and pixel phones.Hey Does anyone here use a Garmin watch with their pixel Hows the connectivity Can you use all of the features Whats your overall review "," Inquiry about seamless connectivity and functionality of Garmin watches when paired with Google Pixel devices.","2024-09-15 10:10:49","App difficult to use"
"neutral","Issue with CMF Watch App on Pixel phone.I just got this CMF Watch Pro 2 in today and tried to set it up  But thats an issue with the sizing of the appWhen picking any options in the app and cant select any options at the bottom because its interference with the Google Pixel 6a buttons  Example on the Dial Gallery Download and Use Replace Watch Face the Replace button at the bottom is under the Pixel 6a square navigation button so I cant go to the next screenIs there a way to resize the screen","
 The CMF Watch Pro 2 app interferes with the Google Pixel 6a buttons, making it impossible to select options due to incorrect screen size.","2024-12-26 00:36:24","App difficult to use"
"neutral","Does the pixel watch work on iPhone using wear OS .So bought the pixel watch 1 in a bit of hurry and just after buying it I realised it apparently does not work with pixel watch Does anyone know if it works using wear OS on iPhone "," The Pixel Watch does not function with iPhone via Wear OS.","2024-09-03 07:57:43","App difficult to use"
"neutral","Deals Samsung Galaxy and Google Pixel phones watches and headphones on sale.nan"," Samsung Galaxy, Google Pixel phones, watches, and headphones are on sale.","2024-12-14 19:33:13","Price related"
"neutral","Google Pixel Watch 5 might be getting a custom Tensor chip  After five generations of Tensorbased phones Google might also be putting a custom chip in its smartwatches.nan","Google Pixel Watch 5 may feature a custom Tensor chip.","2024-10-28 13:08:00","Bluetooth Issues"
"neutral","Sold pixel watch try to pair with my phone.I did a factory reset of my pixel watch 2 then I sold it to a coworker He told me he set it up properly  pair it with his phone yet I keep receiving pairing notification on my phone which is annoyingDoes anyone know what should I do to not receive those notification"," My Pixel Watch 2 continues to send pairing notifications despite being sold. How can I stop these alerts?","2024-12-04 14:38:37","Pairing Issues"
"neutral","Will the pixel watch 2 work with a rooted phone.I am about to root my phone and wanted to know if my pixel watch 2 will still work and connect to my pixel 8 when its rooted"," The Pixel Watch 2 may not function properly when connected to a rooted Pixel 8 device.","2024-11-26 14:42:49","Sync issues"
"neutral","Take a pic using watch non pixel with a Pixel phone.Is there an app or way to take a pic using a Samsung Galaxy watch and a Pixel phone I think the Pixel watch you can natively and I think you can if have a Samsung watch and phone but what about Sammy watch and pixel phone I know I have add me but wondering if theres another option "," Is there a way to capture photos with a Samsung Galaxy Watch and Google Pixel phone?","2024-11-03 11:06:39","App difficult to use"
"neutral","Google Pixel Watch stuck on Continue on phone after set up.Hey guys please I need your helpI got the PW2 recently and Ive been trying to set it up ever since with my Samsung Note 10 and its been a frustrating annoying experience  Ive combed through the internet for fixes and none apply to meI turn on the device downloaded the Google Pixel Watch app from the playstore I start the whole set up process pair the watch to the phone THROUGH the app heard connecting first doesnt work once the pairing is done the watch shows Continue on phone I continue the set up signing into google theres no way to skip it copying data and the whole setup routine everything works perfectlyNow I see my watch in the app it shows connected but beneath that I see a Watch not paired error and a button asking me to reset the watch Ive tried this way more than 30 times and Im not exaggeratingIve tried connecting the watch to a wifi tried the date and time fix literally everything I saw on the internet just still not able to get this to workI attached an image for visual representationhttpspreviewredditjppr7mqi46ld1jpgwidth3024formatpjpgautowebpsa2f3594e9d436f5ff5574c9a135b38e7cc754679"," Google Pixel Watch remains stuck on ""Continue on phone"" post-setup, despite multiple attempts to resolve the issue.","2024-08-27 08:35:42","Pairing Issues"
"neutral","Does the pixel watch connect with the pixel 3 phone .Is the"," Does the Pixel Watch pair with the Pixel 3 phone?","2024-09-10 23:33:09","Sync issues"
"neutral","Galaxy Watch On Pixel Phone.I currently have a Galaxy watch and a Galaxy phone and I am able to send texts from my watch while its connected via Bluetooth with the phone I have a pixel 9 Pro ordered and I was wondering if I could connect the Galaxy watch to that and also be able to text via Bluetooth"," Can the Galaxy Watch be paired with a Pixel 9 Pro for sending texts via Bluetooth?","2024-09-23 16:06:08","Bluetooth Issues"
"neutral","Google Pixel Prime Big Deal Days deals Phones watches earbuds.nan"," Google Pixel Prime, Phones, Watches, and Earbuds are on sale during Big Deal Days.","2024-10-08 17:22:23","Bluetooth Issues"
"neutral","Google starts selling 3in1 charging dock for Pixel phones Watch and Buds  just not the one you want.nan"," Google markets a 3-in-1 charging dock for Pixel devices, but it doesn't cater to your preferred model.","2024-10-15 20:00:06","Bluetooth Issues"
"neutral","I found all my Pixel boxes in the garage last night.nan"," Found multiple Pixel devices stored in the garage.","2025-02-23 12:34:49","Sync issues"
"neutral","Any instructions out there on hacking the iPhone or Pixel Watch to talk to each other .Ive got some familiarity with the developer toolkits and stuff I understand theres not official support trying to decide if any unofficial hacking would be worth it before I swap "," There are no known methods to hack an iPhone and Pixel Watch to communicate directly, as there is no official support for such interaction.","2024-09-21 00:03:09","App difficult to use"
"neutral","I get this persistent notification after I used my work email on the Pixel Watch 2Any workarounds Clicking Open on Phone does nothing .nan"," The Pixel Watch 2 persistently displays a notification following use of the work email that cannot be resolved by clicking ""Open on Phone.""","2024-07-25 02:59:14","Notification issues"
"neutral","Pixel watch 3 nest camera on Samsung phone .Ive got a Samsung S22 ultra and just got my pixel watch 3  It seems I can view notifications from my nest camera on my watch but I cant get a live view despite having Google home on the phone and watch  Shouldnt I be able to view a live feed of my camera  I didnt think this was a pixel only feature "," Despite having Google Home app on Samsung S22 Ultra and Pixel Watch 3, unable to access a live feed from Nest Camera.","2024-09-13 16:22:51","Notification issues"
"neutral","if i add cellular to my watch from a seperate carrier from my phone will the pixel phone forward and texts to my watch.for example if i have visible on my phone and sign up with att on my watch will the phone forward calls and messages to my watch  Will i be able to make calls and messages from my phones phone number "," Will the Pixel phone forward calls and texts to an AT&T-connected smartwatch when it's paired with a Visible phone?","2024-05-29 18:04:32","Voice Commands"
"neutral","Does your LTE Pixel Watch still sync phone notifications when not in Bluetooth range.So in the past when I would go outside with only the LTE Pixel Watch and leave my phone at home I would still get phone notifications relayed to the watch via LTE synced through my Google account This was without an option to reply because apparently this was only a oneway thing but at least I could read messages on the go even for apps that dont have a standalone WearOS versionUnfortunately this doesnt seem to work anymore and I dont even know since when Might already be for months This use case doesnt come up very often for me but it was nice to know that Id always get phone notifications even when I had only the watch on meDid they just quietly discontinue this feature Or does it still work for you guysgals Am I missing a setting that I have to activate somewhereNote I do still get SMS or calls just fine over LTE because those run directly on the watch anyway Im only talking about apps here that do not have a WearOS version like for example Signal messengerEdit Its working again No idea how or what I did but Ill take it"," LTE-synced phone notifications via Google account no longer seem to work on the Pixel Watch; the issue may be temporary or related to a setting change.","2024-04-19 08:29:26","Notification issues"
"neutral","I attended the Made By Google Canadian Preview showcasing the new Pixel 9 Phones Pixel Watch 3 and Pixel Buds 2.nan"," The event highlighted the latest offerings of Google: Pixel 9 Phones, Pixel Watch 3, and Pixel Buds 2.","2024-08-13 21:33:44","User Experience"
"neutral","Help  I dont want my pixel watch accepting phone calls.I have tried to change the notifications permissions for phone calls on my pixel watch but the onoff slider is greyed out therefore disallowing me from changing the settingI dont want phone calls going to my watch because the watch automatically rejects the calls and makes them go to voicemail  unlike my pixel phone which lets the call ring on silent so I can look and decide whether or not to answer itI dont understand why its not straightforward to correct the settings Please if anyone has any ideas let me know"," Cannot modify phone call notification settings on Pixel Watch, causing automatic rejection of calls.","2024-04-09 23:01:03","Voice Commands"
"neutral","Watch  pixel 1 Phone  pixel 4a Calendar from my phone not syncing to my watch suggestions.nan"," My Pixel 1 phone's calendar is not syncing with the Pixel 4a watch.","2024-04-14 04:25:11","Sync issues"
"neutral","Using my 6 classic 47mm with a Pixel 8 pro Phone still rings along with the watch but notifications are completely muted on the phone .This is always checked yet the phone still rings while wearing the watch "," Notifications are silenced on the Pixel 8 Pro when paired with a 47mm smartwatch, but calls continue to ring.","2024-06-05 19:00:09","Notification issues"
"neutral","Dexcom 7 monitoring on Pixel 7 phone and Pixel Watch 2 via Gluroo app.nan"," The Dexcom 7 glucose monitoring is enabled on both the Pixel 7 phone and Pixel Watch 2 through the Glucoo app.","2024-04-04 16:12:55","App difficult to use"
"neutral","Ive just got a pixel watch and tried to use camera remote function with my magic 6 pro but it requires google camera to be installed on phone and it only lets me install on watch not available for honor.nan"," The Google Camera app must be installed on the Honor Magic 6 Pro to use the camera remote function with the Pixel Watch, as installation is only supported on the watch, not the phone.","2024-05-17 14:59:13","App difficult to use"
"neutral","Anker Prime 100W USB C Charger Anker GaN Wall Charger 3Port Compact Fast PPS Charger for MacBook ProAir Pixelbook iPad Pro iPhone 14  Pro Galaxy S23  S22 Note20 Pixel Apple Watch and More 6999.AmazoncahttpswwwamazoncadpB0C4DGBHY2linkCodell1tag298320linkId4e1a9dbe5a1d0367ee9ce820e8db11f4languageenCArefaslisstl","3-port compact GaN charger for fast charging multiple devices, including MacBook Pro, iPad Pro, iPhone 14, Galaxy S23, and Apple Watch.","2024-05-06 23:24:06","Price related"
"neutral","Unlocking phone with pixel watch.Does anyone else having issues with smart watch unlocking the phone For most of the time it only works like probably 40 I am using first pixel watch and P7 Pro I am not sure if i am doing something wrong"," The Pixel Watch and P7 Pro are experiencing inconsistent phone unlocking functionality.","2024-04-19 15:11:39","Bluetooth Issues"
"neutral","You Can charge you pixel watch via the smartphone for quick juice.My phone was at 50 Watch at 79Phone dropped to 45Watch was at 97"," The Pixel Watch can be charged using a connected smartphone for quick power transfer.","2025-02-18 18:13:54","App difficult to use"
"neutral","I have a Pixel Fold with Galaxy Buds Pro 2 Every now and then I would get this bug where my videos do this and not play sound When I disconnect the earbuds it plays as normal I uninstalled the earbuds from the phone and reconnected them that worked before but this time nothing is working.nan"," ""The Pixel Fold with connected Galaxy Buds Pro 2 is causing intermittent video audio issues, which persist even after disconnection and reconnection.""","2025-03-06 19:31:26","Audio quality issues"
"neutral","Pixel pro 2 buds and iPhone.I currently have an iPhone and am planning on switching to a pixel 9 in a few months but needed new headphones so I got these In the meantime Im trying to set up how to find them and it says I can do it via the web but it just shows me a map and says I dont have any connected devices Any ideas"," The Google Pixel Buds Pro cannot be paired with an iPhone, only devices running Android OS.","2025-03-03 12:31:05","Bluetooth Issues"
"neutral","Goodbye Pixel 6a Hello CMF Phone 1 and Buds pro 2.nan"," Transition from Google's Pixel 6a to CMF Phone 1 and Buds Pro 2 marks a shift in device choice.","2024-08-06 15:51:41","Bluetooth Issues"
"neutral","Volume too loud on wired Pixel Buds  Pixel 7 phonehow to lower.nan","How to reduce the volume of wired Pixel Buds on a Pixel 7 phone.","2025-02-14 16:52:08","Audio quality issues"
"neutral","Pixel Buds on Pixel Phone .I keep hearing that there are options for the Buds only available on a Pixel phone but not what they are I have an 8 Pro can anyone fill me in "," Pixel Buds features exclusive to Pixel phones aren't explicitly documented; seeking details if any are inaccessible on non-Pixel Android devices, particularly the 8 Pro.","2025-01-11 22:42:41","Bluetooth Issues"
"neutral","Google starts selling 3in1 charging dock for Pixel phones Watch and Buds  just not the one you want.nan"," Google markets a 3-in-1 charging dock for Pixel devices, but it does not cater to the desired model.","2024-10-15 20:00:06","Bluetooth Issues"
"neutral","Pixel buds Pro 2 and Pixel phone.The Samsung Galaxy Buds have features only available when paired with a Galaxy phoneDo the new Pixel Buds Pro 2 have any features that are unique when paired with a Pixel phoneThanks "," The new Pixel Buds Pro 2 offer exclusive features when used with a Pixel phone.","2024-10-03 06:59:15","Pairing Issues"
"neutral","Engadget review recap iPhones AirPods Pixel Buds and an early look at the PlayStation 5 Pro.nan"," The Engadget review summarizes comparisons between Apple's AirPods, Google's Pixel Buds, and various iPhone models, alongside a sneak peek at the potential future release of PlayStation 5 Pro.","2024-09-28 13:07:04","Audio quality issues"
"neutral","Hey Google now has to be enabled on phones to work on Pixel Buds.nan"," To use Pixel Buds with Google Assistant, phone's ""Hey Google"" needs to be activated.","2024-09-06 05:00:06","Bluetooth Issues"
"neutral","I attended the Made By Google Canadian Preview showcasing the new Pixel 9 Phones Pixel Watch 3 and Pixel Buds 2.nan"," The event highlighted the launch of Google's Pixel 9 phones, Pixel Watch 3, and Pixel Buds 2.","2024-08-13 21:33:44","User Experience"
"neutral","Im switching at iOS will my pixel buds work with an iPhone or will I have to buy air pods .Imma buy air pods eventually anyways Im just wondering if Id have to buy at the same time or I can wait so I have more money"," Will Pixel Buds work with an iPhone?","2024-05-19 17:57:21","Software updates"
"neutral","Pixel buds Pro micro phone issues when ceiling fan is on.Is anyone facing the issue that pixel buds Pro microphone quality is bad when the ceiling fan is on"," Ceiling fan interference affects the microphone quality of Pixel Buds Pro.","2024-06-28 23:14:53","Audio quality issues"
"neutral","Pixel 9a leaked image showing huge bezels.This is simply inexcusable even under 10 k phones have less bezels","10k phones currently have less pronounced bezels than the alleged Pixel 9a, as suggested by its leaked image.","2025-03-15 15:19:45","Bluetooth Issues"
