"sentiment","user_review","summary","time_frame","Issue Category"
"neutral","Pixel Buds Pro 2 one of the buds suddenly loses sound while being connected and randomly comes back or not.Ive been looking here for other reports but I didnt see anything really similar to this issue  However a few people seem to experience it too see herereport on rpixelbudshttpswwwredditcomrpixelbudscomments1ik6yqxpixelbudspro2randomlyoneoftheearbudsutmsourceshareutmmediumweb3xutmnameweb3xcssutmterm1utmcontentsharebutton To keep it simple while playing sound usually music my left bud suddenly stops playing Sound keeps playing on the right one and both stay connected to my phone Pixel 8a latest stable version Android 15 Touching the bud still pauses the music noise cancellation still works but no sound It sometimes comes back if I pause then play then pause multiple times or play with random settings such as noise cancellation but sometimes the only workaround is to put it back in the suitcase for a few seconds Also both buds seems a bit slow to process commands when it happens  It can happen 4 times a day and then no issue another day Did a factory reset nothing changed It seems like it appeared after the last update release 3144Anyone has been experiencing thisEDIT  its been a while now still happening Support was not helpful Plot twist today the issue changed sides all of a sudden and it happened with my right bud I suspect a connectivity issue with multiple devices used my buds for two days without my pixel watch connected and the problem didnt show up Took my watch with me today and it happened again Ill try with and without it for the week and let you know a similar issue had happened before in Android 14 and was only patched two months later with Android 15SECOND EDIT  was hoping some fixes with Android 15 QPR2 but nothing Im pretty sure the bug only happens when my phone is connected to my pixel watch while playing on my buds Connectivity issue again"," The Pixel Buds Pro 2 intermittently loses sound in one earbud during use, and this issue appears to be related to a connectivity problem when the device is connected to another Bluetooth device like a smartwatch.","2025-02-10 17:28:20","Bluetooth Issues"
"neutral","NEW Apple is planning a new AirPods feature as part of iOS 19 that will enable livetranslation of conversations similar to features available on the Google Pixel Buds and other earbuds.nan"," Apple plans to introduce real-time conversation translation in AirPods with iOS 19, similar to some existing earbud technologies (e.g., Google Pixel Buds).","2025-03-13 20:04:49","Voice Commands"
"neutral","Pixel Buds Pro 2 More Secure in Charging Case.Ive got the Pixel Buds Pro first Gen My left bud no longer keeps a charge for more than about 2 hours so Im thinking of upgradingOne of my major annoyances with the original Pixel Buds Pro is that sometimes they dont stay seated in the case so they remain charging If Im lucky I notice this through them not having disconnected from my phone and nudge them a bit until they do If Im unlucky I pull them back out and one or both of them has no charge To those with the Pixel Buds Pro 2 do you experience this at all"," The original Pixel Buds Pro sometimes fail to maintain a secure connection within their charging case.","2025-03-24 00:39:31","Bluetooth Issues"
"neutral","Spatial Audio showing up on pixel 8a.Was connecting my galaxy buds to my phone then spatial Audio showed up out of nowhere I thought this wasnt on the pixel 8a Can anyone explain"," Galaxy Buds' Spatial Audio unexpectedly appeared on Pixel 8a, not a native feature on that device.","2025-02-04 09:14:18","Audio quality issues"
"neutral","I just bought Pixel Buds Pro at Walmart for 72.They are on clearance I did a quick check on my phone while waiting for someone to unlock the glass and I didnt see them online but they were there"," The Pixel Buds Pro at Walmart are currently on clearance sale, not available online as of my last check.","2024-10-05 18:42:10","Bluetooth Issues"
"neutral","Pixel Buds Pro 2 cant read notifications.I just got a brand new pair of Pixel buds Pro 2 and when I try to use the assistant to read my notifications from my phone it says that they cant do it yet because there is no permission from my phone to let them read notifications I have changed all the permissions and notifications in the Google app on my phone in the phone setting itself in the Pixel buds app everything I can think of to allow all permissions and I still have the problemThe phone is a Samsung Galaxy s21 Ultra"," On Samsung Galaxy S21 Ultra, the Pixel Buds Pro 2 cannot access notification permissions yet.","2025-03-15 21:57:21","Notification issues"
"neutral","GemniPixel buds email.httpspreviewredditibwzd1saezqd1pngwidth648formatpngautowebpsbdc58679351fa6b87e0989766b1429eebbf640a0Just recieved this email this morning Id like to know what the general sentiment around this is  Im still insanely upset they removed the hold for notificaitons option its basically the reason i dont a pb2","User is expressing frustration over the removal of the ""Hold for Notifications"" feature in GeminiPixel Pixel Buds.","2024-09-25 16:24:47","Notification issues"
"neutral","Pixel Buds A audio pause.Is there a way to have the earbuds not stop playing when I take them out of my ears when connected to iPhone"," On iPhone, disabling auto-pause feature for Pixel Buds A during removal from ears would be beneficial.","2025-03-12 22:41:03","Audio quality issues"
"neutral","Pixel 8 pro Bluetooth issues.I had Bluetooth issues with my pixel 8 Pro ever since I bought it I have a pair of Samsung galaxy bud 2 pros and a pair of Sony xm3s It was usually fine with the xm3s but the buds 2 pros would always have static when taking a call and coming back to regularly playing audio I eventually got sick of the issue and went online looking for a fix and somebody told me to change the map value in the Bluetooth audio settings in developer settings I changed it from 12 to 14 I tried to reset all my settings and pair everything the same and I found other issues which were mitigated by changing something with disabling Bluetooth le hardware offload but this left my headphones not sounding very good So I set it back to 12 and ever since all Bluetooth problems have been resolved it never cuts out anymore It connects faster than ever and doesnt have issues when switching between phone calls and media I was so close to sending this phone back I like everything else about it but this issue was a deal breaker for me luckily its now fixed "," The Pixel 8 Pro had persistent Bluetooth static issues with Samsung Galaxy Buds 2 Pro during calls, which were resolved by adjusting the map value in Bluetooth audio settings.","2025-03-16 21:06:37","Bluetooth Issues"
"neutral","Zfold6 or pixel 9 pro fold.I need to upgrade my current Note 20 Ultra for a newer model I am debating between the ZF6 and Pixel 9 Pro Fold I have the Galaxy Watch 7 Ultra and Galaxy Buds 3 Pro I went to the store and compared both phones but the Pixel appears larger than the ZF6 Which phone should I choose Can I use my watch and buds with the Pixel "," I'm deciding between the ZF6 (Zfold6) and Pixel 9 Pro Fold, considering their size differences in relation to my current Note 20 Ultra. Is compatibility with Galaxy Watch 7 Ultra and Buds 3 Pro assured on both devices?","2024-09-28 14:49:12","App difficult to use"
"neutral","Pixel buds pro  washing machine.Sooo I sent my pixel buds pros through the washing machine I pulled them out about halfway through the load They still worked still dripping wet right out of the washer I dried them out but now the Bluetooth will not disconnect from my phone I disconnect them from my phone manually but in a minute they reconnect even while in their caseAnyone have this happen to them Can this be fixed"," Washing machine exposure caused Pixel Buds Pro to have persistent Bluetooth connection issues post-drying.","2024-07-27 14:17:12","Bluetooth Issues"
"neutral","Pixel buds pro 2 amplifying loud noises to be even louder.I love my Pixel buds pro 2 and the transparency mode is really good except for one thing it amplifies loud noises to be even louder to the point where I it hurts and I think it might be harmful to my earsThere are usually two places I notice this and rush to turn off transparency mode in the subway when a metro approaches  on the street when an emergency vehicle passes with sirensIt feels like transparency mode just blindly amplifies everything and ignores the volume limit You could almost say it works a bit too wellPersonally I prefer using transparency mode in public so I properly notice everything happening around me but this makes it annoying to useHas anyone else noticed this I was surprised at first that this even happens at all given the new features around Hearing Welness"," The Pixel Buds Pro 2's Transparency Mode amplifies loud noises excessively, potentially causing discomfort and potential harm.","2024-12-16 03:56:18","Audio quality issues"
"neutral","GALAXY S25 62 VS PIXEL 9 PRO 63.Im already getting a headache from choosing a phone for myself Unfortunately my LG G6 is already in such a state that I have to charge it 23 times per day Using the presale I bought a Galaxy S25 62 with Galaxy Watch 7 and Buds 3 Pro Unfortunately I am seriously disappointed with the camera capabilities I live near the forest and I would like to take occasional photos of animals and the telephoto in this phone is practically useless in this case So I also started to consider the Pixel 9 Pro 63 Unfortunately the Tensor G4 processor put me off earlier When I bought the LG G6 I received a weaker processor from the very beginning This time I would like to buy a phone with the best possible performanceIf I decided on the only Pixel 9 Pro it would cost as much as Galaxy S25 512 GB  Watch 7  Buds 3 Pro together What do you think what should I do Of course I also considered the OnePlus 13 but this phone is probably too big for me Thank you for all answers"," Despite the superior camera capabilities of Pixel 9 Pro and the stronger processor in Galaxy S25, the cost difference and size concerns make a definitive choice challenging.","2025-03-03 22:24:16","Video quality Issues"
"neutral","Pixel Buds Pro 2 not showing up on Web Find my device.Anyone else run into this  I just got some PBP2 added them to my Pixel  they show up in the app on my phone but when I log into the web app on my PC I dont see them but can see my phone watch and tablet"," The Pixel Buds Pro 2 are not appearing on the Web Find My Device for some users.","2025-02-16 00:24:18","App difficult to use"
"neutral","I have a Pixel Fold with Galaxy Buds Pro 2 Every now and then I would get this bug where my videos do this and not play sound When I disconnect the earbuds it plays as normal I uninstalled the earbuds from the phone and reconnected them that worked before but this time nothing is working.nan"," ""My Pixel Fold device experiences intermittent video sound issues when connected to Galaxy Buds Pro 2, and the usual troubleshooting steps (disconnecting and reconnecting, as well as uninstalling/reinstalling) have not resolved the problem.""","2025-03-06 19:31:26","Audio quality issues"
"neutral","Pixel pro 2 buds and iPhone.I currently have an iPhone and am planning on switching to a pixel 9 in a few months but needed new headphones so I got these In the meantime Im trying to set up how to find them and it says I can do it via the web but it just shows me a map and says I dont have any connected devices Any ideas"," The Google Pixel Buds Pro are not automatically discoverable or pairable with an iPhone, despite attempts to connect them through the web.","2025-03-03 12:31:05","Bluetooth Issues"
"neutral","Goodbye Pixel 6a Hello CMF Phone 1 and Buds pro 2.nan"," Transition from Google Pixel 6a to CMF Phone 1 and Buds Pro 2 signifies a change in device and earbud models.","2024-08-06 15:51:41","Bluetooth Issues"
"neutral","Pixel buds Pro 2 and Pixel phone.The Samsung Galaxy Buds have features only available when paired with a Galaxy phoneDo the new Pixel Buds Pro 2 have any features that are unique when paired with a Pixel phoneThanks "," The new Pixel Buds Pro 2 have no exclusive features when paired with a Pixel phone.","2024-10-03 06:59:15","Pairing Issues"
"neutral","Engadget review recap iPhones AirPods Pixel Buds and an early look at the PlayStation 5 Pro.nan"," The Engadget review summarizes comparisons between AirPods, Pixel Buds, iPhones, and a sneak peek of potential PlayStation 5 Pro technology.","2024-09-28 13:07:04","Audio quality issues"
"neutral","Pixel buds Pro micro phone issues when ceiling fan is on.Is anyone facing the issue that pixel buds Pro microphone quality is bad when the ceiling fan is on"," Ceiling fan interference affects the microphone quality of Pixel Buds Pro.","2024-06-28 23:14:53","Audio quality issues"
"neutral","Pixel 9a leaked image showing huge bezels.This is simply inexcusable even under 10 k phones have less bezels"," Leaked Pixel 9a image reveals excessive screen bezels compared to budget smartphones.","2025-03-15 15:19:45","Bluetooth Issues"
"neutral","Pixel Buds Pro 2 one of the buds suddenly loses sound while being connected and randomly comes back or not.Ive been looking here for other reports but I didnt see anything really similar to this issue  However a few people seem to experience it too see herereport on rpixelbudshttpswwwredditcomrpixelbudscomments1ik6yqxpixelbudspro2randomlyoneoftheearbudsutmsourceshareutmmediumweb3xutmnameweb3xcssutmterm1utmcontentsharebutton To keep it simple while playing sound usually music my left bud suddenly stops playing Sound keeps playing on the right one and both stay connected to my phone Pixel 8a latest stable version Android 15 Touching the bud still pauses the music noise cancellation still works but no sound It sometimes comes back if I pause then play then pause multiple times or play with random settings such as noise cancellation but sometimes the only workaround is to put it back in the suitcase for a few seconds Also both buds seems a bit slow to process commands when it happens  It can happen 4 times a day and then no issue another day Did a factory reset nothing changed It seems like it appeared after the last update release 3144Anyone has been experiencing thisEDIT  its been a while now still happening Support was not helpful Plot twist today the issue changed sides all of a sudden and it happened with my right bud I suspect a connectivity issue with multiple devices used my buds for two days without my pixel watch connected and the problem didnt show up Took my watch with me today and it happened again Ill try with and without it for the week and let you know a similar issue had happened before in Android 14 and was only patched two months later with Android 15SECOND EDIT  was hoping some fixes with Android 15 QPR2 but nothing Im pretty sure the bug only happens when my phone is connected to my pixel watch while playing on my buds Connectivity issue again"," The Pixel Buds Pro 2 experience random sound loss in one earbud, possibly related to connectivity issues when used simultaneously with a Pixel Watch.","2025-02-10 17:28:20","Bluetooth Issues"
"neutral","Pixel Buds Pro 2 More Secure in Charging Case.Ive got the Pixel Buds Pro first Gen My left bud no longer keeps a charge for more than about 2 hours so Im thinking of upgradingOne of my major annoyances with the original Pixel Buds Pro is that sometimes they dont stay seated in the case so they remain charging If Im lucky I notice this through them not having disconnected from my phone and nudge them a bit until they do If Im unlucky I pull them back out and one or both of them has no charge To those with the Pixel Buds Pro 2 do you experience this at all"," The original Pixel Buds Pro have an issue where they may not stay properly seated in the charging case, causing intermittent charging.","2025-03-24 00:39:31","Bluetooth Issues"
"neutral","Spatial Audio showing up on pixel 8a.Was connecting my galaxy buds to my phone then spatial Audio showed up out of nowhere I thought this wasnt on the pixel 8a Can anyone explain"," Pixel 8A unexpectedly activated Spatial Audio when connected to Galaxy Buds.","2025-02-04 09:14:18","Audio quality issues"
"neutral","I just bought Pixel Buds Pro at Walmart for 72.They are on clearance I did a quick check on my phone while waiting for someone to unlock the glass and I didnt see them online but they were there"," ""Pixel Buds Pro are available at Walmart's in-store clearance sale, not listed online.""","2024-10-05 18:42:10","Bluetooth Issues"
"neutral","Pixel Buds Pro 2 cant read notifications.I just got a brand new pair of Pixel buds Pro 2 and when I try to use the assistant to read my notifications from my phone it says that they cant do it yet because there is no permission from my phone to let them read notifications I have changed all the permissions and notifications in the Google app on my phone in the phone setting itself in the Pixel buds app everything I can think of to allow all permissions and I still have the problemThe phone is a Samsung Galaxy s21 Ultra"," On the Samsung Galaxy S21 Ultra, the Pixel Buds Pro 2 lack compatibility for reading notifications.","2025-03-15 21:57:21","Notification issues"
"neutral","Pixel 8 pro Bluetooth issues.I had Bluetooth issues with my pixel 8 Pro ever since I bought it I have a pair of Samsung galaxy bud 2 pros and a pair of Sony xm3s It was usually fine with the xm3s but the buds 2 pros would always have static when taking a call and coming back to regularly playing audio I eventually got sick of the issue and went online looking for a fix and somebody told me to change the map value in the Bluetooth audio settings in developer settings I changed it from 12 to 14 I tried to reset all my settings and pair everything the same and I found other issues which were mitigated by changing something with disabling Bluetooth le hardware offload but this left my headphones not sounding very good So I set it back to 12 and ever since all Bluetooth problems have been resolved it never cuts out anymore It connects faster than ever and doesnt have issues when switching between phone calls and media I was so close to sending this phone back I like everything else about it but this issue was a deal breaker for me luckily its now fixed "," On my Pixel 8 Pro, static during phone calls with Samsung Galaxy Buds 2 Pro was resolved by adjusting the map value in Bluetooth audio settings within developer options.","2025-03-16 21:06:37","Bluetooth Issues"
"neutral","Zfold6 or pixel 9 pro fold.I need to upgrade my current Note 20 Ultra for a newer model I am debating between the ZF6 and Pixel 9 Pro Fold I have the Galaxy Watch 7 Ultra and Galaxy Buds 3 Pro I went to the store and compared both phones but the Pixel appears larger than the ZF6 Which phone should I choose Can I use my watch and buds with the Pixel "," I'm considering whether to upgrade from Note 20 Ultra to either ZF6 or Pixel 9 Pro Fold; the latter seems larger. Will Galaxy Watch 7 Ultra and Buds 3 Pro be compatible?","2024-09-28 14:49:12","App difficult to use"
"neutral","Pixel buds pro  washing machine.Sooo I sent my pixel buds pros through the washing machine I pulled them out about halfway through the load They still worked still dripping wet right out of the washer I dried them out but now the Bluetooth will not disconnect from my phone I disconnect them from my phone manually but in a minute they reconnect even while in their caseAnyone have this happen to them Can this be fixed"," washing machine exposure caused Pixel Buds Pro to malfunction, with persistent Bluetooth reconnection issue post-drying.","2024-07-27 14:17:12","Bluetooth Issues"
"neutral","Pixel buds pro 2 amplifying loud noises to be even louder.I love my Pixel buds pro 2 and the transparency mode is really good except for one thing it amplifies loud noises to be even louder to the point where I it hurts and I think it might be harmful to my earsThere are usually two places I notice this and rush to turn off transparency mode in the subway when a metro approaches  on the street when an emergency vehicle passes with sirensIt feels like transparency mode just blindly amplifies everything and ignores the volume limit You could almost say it works a bit too wellPersonally I prefer using transparency mode in public so I properly notice everything happening around me but this makes it annoying to useHas anyone else noticed this I was surprised at first that this even happens at all given the new features around Hearing Welness"," Pixel Buds Pro 2's Transparency Mode excessively amplifies loud noises, potentially causing discomfort or harm to ears.","2024-12-16 03:56:18","Audio quality issues"
"neutral","GALAXY S25 62 VS PIXEL 9 PRO 63.Im already getting a headache from choosing a phone for myself Unfortunately my LG G6 is already in such a state that I have to charge it 23 times per day Using the presale I bought a Galaxy S25 62 with Galaxy Watch 7 and Buds 3 Pro Unfortunately I am seriously disappointed with the camera capabilities I live near the forest and I would like to take occasional photos of animals and the telephoto in this phone is practically useless in this case So I also started to consider the Pixel 9 Pro 63 Unfortunately the Tensor G4 processor put me off earlier When I bought the LG G6 I received a weaker processor from the very beginning This time I would like to buy a phone with the best possible performanceIf I decided on the only Pixel 9 Pro it would cost as much as Galaxy S25 512 GB  Watch 7  Buds 3 Pro together What do you think what should I do Of course I also considered the OnePlus 13 but this phone is probably too big for me Thank you for all answers"," Despite considering both Galaxy S25 62 and Pixel 9 Pro 63, I'm struggling with the choice due to the telephoto capabilities in Galaxy S25 being insufficient for my forest photography needs, and the Tensor G4 processor in Pixel 9 Pro causing initial reservations. The cost of Pixel 9 Pro versus the combined price of Galaxy S25, Watch 7, and Buds 3 Pro is also a factor. I'm considering other options like OnePlus 13 but find it too large.","2025-03-03 22:24:16","Video quality Issues"
"neutral","Pixel Buds Pro 2 not showing up on Web Find my device.Anyone else run into this  I just got some PBP2 added them to my Pixel  they show up in the app on my phone but when I log into the web app on my PC I dont see them but can see my phone watch and tablet"," Pixel Buds Pro 2 are not appearing in the Web Find My Device interface, despite being visible on the associated smartphone app.","2025-02-16 00:24:18","App difficult to use"
"neutral","Pixel Buds Pro 2  Issue.Ive noticed that all of a sudden my ear buds seem to have the plugged ear feeling even when in transparency mode It just feels different Before didnt feel like this I also tried to do the ear seal check multiple times and it keeps saying they need to be adjusted Before it always worked I tried to get support through Google and they just say they need to escalate and will email me Not very supportive if you ask me If I dont hear back in a bit I will have to call I guess Didnt get that runaround when my phone had issues Anyone else have similar issues"," Pixel Buds Pro 2 are experiencing an issue where they suddenly feel plugged even in Transparency mode despite multiple adjustments, and user finds customer support unresponsive.","2024-11-27 19:33:15","Audio quality issues"
"neutral","USAPA H PayPal W Pixel 9 pro fold pixel buds pro 2.Post before pming Phone must be unlocked "," Unlocking the phone is required before using it with PayPal Pixel 9 Pro and Pixel Buds Pro 2.","2025-01-13 17:01:17","Pairing Issues"
"neutral","Pixel buds pro connection issue .Recently for a few days ive been having issues with pixel buds protapping an earphone doesnt stop playing turning volume by touch or just on the phone doesnt change volume at all or just turning off one bud SO i decided to reset the buds in the box and forgetting them on the phone to pair again My phone doesnt see them anymore when i click on pair new devices it says looking for devices to pair and the loading circle is going forever Im so mad lolPhoneGoogle Pixel 8 ProEarbudsPixelbuds ProIdk what to do xD"," Pixel Buds Pro are not visible or pairing with Google Pixel 8 Pro, despite multiple attempts at resetting and re-pairing.","2025-01-03 17:25:28","Pairing Issues"
"neutral","Have you ever encountered a problem that Pixel Buds Pro 2 are not displayed in the Find Device service.Greetings Today I have become an owner of the second generation of the pixel buds pro They work great and I paired them with my Pixel without any problems But I ran into a problem where the new headphones are not displayed in the Find Device serviceWhen I press the Find device in the official Pixel Buds application it allows me to only ring headphones and requires to turn on use location and location history in the phones settings to find the case But I already have geolocation and timeline enabled check Imgur screenshotsI also checked that the headphones are linked to my Google account yes and reset and paired them twice  nothing helpedHave you ever had such a problem and how did you solve itImgur with screenshotshttpsimgurcomanNRpsPL"," The Pixel Buds Pro 2 are not visible in the Find Device service despite being paired, location services enabled, and multiple resets.","2025-01-18 22:43:48","Bluetooth Issues"
