"sentiment","user_review","summary","time_frame","Issue Category"
"neutral","Why cant we have an Android TV experience similar to Android Auto using Pixel phones via USBC to HDMI .why theres no option to connect our Pixel phones to a TV via USBC to HDMI to get an Android TVlike experience similar to how Android Auto works with car displays It seems like a convenient way to use our phones as a media center without needing a separate deviceDoes anyone know if there are technical limitations or other reasons why this isnt available Would love to hear your thoughts and insights on thisPSJust imagine the possibility of our used old phones as Android TV Do you think Chromecast is as powerful as our phones "," It appears that using Pixel phones for an Android TV-like experience via USB-C to HDMI is currently not available, raising questions about technical limitations or other factors.","2024-05-13 01:57:12","Android Auto Issues"
"neutral","Pixel 6 Pro  People cant hear me anymore since Android 15 update.Hello EveryoneYesterday I received the Android 15 update on my Pixel 6 pro however today I started noticing that people arent able to hear me when I talk I am able to hear the other person thou but they cant hear meThe issue gets temporarily fixed as soon as I reboot the phone After a few calls the issue starts happening again  Has this occurred to anyone"," With Android 15 update on Pixel 6 Pro, microphone problems are causing difficulty in being heard during calls.","2024-10-18 10:26:31","Bluetooth Issues"
"neutral","Mative Linux on Google Pixel.Since today after a Software update there is a terminal app on my Pixel 7a I only had to activate it in the developer settingsSo far Ive only tested vim and the arm apt store were Ive downloaded neofetch Everything worked exactly as intended Of course its a bit awkward on a mobile phone keyboard but I believe this is a step for google towards a DesktopAndroid where you can connect an Android phone to a monitor and it automatically switches"," Google Pixel 7a now supports Mate Linux, allowing users to run terminal apps like vim and access the arm apt store.","2025-03-19 07:33:00","App difficult to use"
"neutral","After several months I now hate the Pixel Fold.To keep it short a crack has formed on the inner screen despite me barely using itThe touch on the external screen is nowhere near as accurate as it used to beAndroid Auto works about 60 of the timeAnd as of late its crashing randomlyAnd with the whole If you send your device to us for repair and you used aftermarket parts well keep it thing going on now I think Ill be switching away from Google phones after this oneJust seems like it was designed more for showing a crowd rather than regular useThats all just came to rant about all the issues Ive had with this phone  Feel free to share your experience with the Fold in the comments  Misery loves company after all"," The Pixel Fold has issues with screen cracking, touch accuracy, random crashing, and unpredictable Android Auto functionality.","2024-06-04 22:19:09","Android Auto Issues"
"neutral","Pixel 8a and Subaru Android Auto.My parents have pixel 8as and my mom has the Subaru but her phone wont connect cuz cable to android Auto We plan on trying a new cable Data cable but is there any other ideas The dealership updated the car and they tried to help connect her phone with no luck and tried to say that Pixels dont work with Android Auto "," The issue lies in connecting a Pixel 8a with Subaru's Android Auto system. Solutions being explored include trying a new data cable, as well as overcoming the dealership's assertion that Pixels are incompatible with Android Auto.","2025-02-09 01:17:09","Android Auto Issues"
"neutral","Both are same price and Im not a mobile gamer Pixel 9 Pro XL or S24 Ultra.Coming from a Pixel 6 Pro which to be fair has been pretty great I mostly use my phone for Android Auto in the car and playing videos while Im doing something some camera usage although not as much as when my kids were younger And of course the usual web browsingemailTEAMS for workbankingetc Not really a power user or mobile gamer So with all that said youd think Pixel 9 Pro XL is a no brainer I do like the bare Android experience But I have a hard time getting over the substantial difference in power and how that will age Will the Pixel be a dog in 25 years because the processor is slow And I dont love that Google is starting to hide their AI features behind a paywall that I will never pay for Thats the whole point of the Tensor processor noAnyways looking for suggestions from anybody who has spent time with both"," I'm considering between Pixel 9 Pro XL and S24 Ultra, but concerned about their long-term performance due to slower processors and Google's decision to hide AI features behind a paywall.","2024-12-09 22:14:56","Video quality Issues"
"neutral","Android AutoGoogle Assistant woes with new pixel.Hi allApologies if this has been asked before however I just moved from iOS to Android Pixel 9 Pro I am having some issues with Google Assistant within Android AutoWhen I ask Google Assistant something the response is compressedmuffled Kinda like the quality of a phone call if that makes senseIs this normal I ask as I never had this issue with SiriCarplay so I dont think theres an issue with my head unit I tried playing around with my Bluetooth settings within my pixel and car however I cant seem to fix itAny ideasThanks for reading"," On Android Auto with the Pixel 9 Pro, Google Assistant responses are compressed or muffled, which wasn't a problem with iOS CarPlay.","2025-03-19 18:45:08","Android Auto Issues"
"neutral","Pixel 8 phone cant charge in my Honda.I was previously using a Huawei and I was always able to charge it in the car whether it was using the normal cable or when using it for the Android Auto HUD but since switching to the Pixel 8 I cant   Is there a cable I can buy or is it really never going to work"," The Pixel 8 phone does not charge in my Honda.","2025-01-30 15:59:18","Android Auto Issues"
"neutral","Pixel phones  auto call recording solution.Hi Guys from quite some time was checking on price drop for P8P and seems deals might come in soon But i noticed one thing that pixel phones dont allow call recording On further check seems its Android call and many phones are now showing this behaviour though allowing it to some extent with some message or sound But Pixels seems restrictive and I check a 6a as well which has no call recording optionIs there a solution for this not root Also dont prefer loudspeaker mic recording options","Pixel phones do not natively support call recording without root access.","2025-01-11 13:28:07","Voice Commands"
"neutral","My Recent Frustrations with Google Pixel 9 Convince me Not to go Back to iPhone.I recently upgraded from an iPhone 12 Pro to a Google Pixel 9 I am liking it so far but I have several frustrations with it bearaly enough to almost break the camels back and go back to iPhone I was wondering if anyone can give me advice or thoughts 1 Battery is not as expected I was expecting to get about 13 hours on onscreen battery life but I am not getting close to that I am getting around 8 hours I recently found the issue or what I think the issue is at least After I use android auto it keeps running in the background all day and drains all of my battery2 When using Spotify to listen to podcasts every time a notification comes in it pauses the podcast plays the notification sound and 75 of the time it resumes the podcast The other 25 of the time it will remain paused for no reason 25 Sometimes the podcast will pause altogether on its own and then I have to press play to resume 3 When using Android Auto WhatsApp voice messages will not play The music volume will lower but the messages will not play 4 Whatsapp does not ring on Android Auto only on the phone so there is no Whatsapp interface on AA 5 On the contrary there is no phone call interface on the phone when youre talking through a regular phone call on Android Auto it only shows in your cars screen Which means that you cannot activate a feature like Call Notes while driving 6 Aggregation of health app data on iPhone all health app data would aggregate on Apple Health and every app would have every other apps data The equivalent on Android health connect is simply not good I use FitBod for strength training and MyNetDiary for calorie tracking On iPhone calories would automatically be aggregated through apple health and would automatically reflect on MyNetDiary but it is failing to do so using Health Connect It shows up as a workout on MyNetDiary but none of the important information like calories aggregates correctly so I must input it manually  Does anyone have any solution to these or can share their thoughts I really really want to stay on Pixel Android forever so I hope I can get at least some of these things fixed so that I dont have to go back ","1. The Google Pixel 9's battery life, podcast playback inconsistencies, and Android Auto issues are frustrating, along with the lack of WhatsApp interface on Android Auto, phone call features while driving, and proper health app data aggregation, causing me to consider switching back to iPhone.","2024-09-02 21:37:08","Android Auto Issues"
"neutral","Poll result The definitive anecdotal proof that Pixel phones overheat.nan"," Anecdotally, Pixel phones tend to overheat, as indicated by the poll results.","2024-07-13 05:47:14","Video quality Issues"
"neutral","Pixel 9 pro not auto updating apps .Just got a pixel 9 pro last week and its not updating apps by its self even know auto update apps is on "," The Pixel 9 Pro does not automatically update apps as set in the device's settings.","2024-10-11 13:07:21","Software updates"
"neutral","Android Auto not recognising device after update Pixel 7.Is there a solution to this I find it annoying that I cant use my phone for navigation Edit coincidentally its resolved itself this morning ","android auto failed to recognize the device on Pixel 7 following an update, but it has since resolved itself independently.","2024-10-24 11:22:38","Android Auto Issues"
"neutral","Pixel 9 Pro XL Bluetooth issue.Im having an odd issue with my 9PXL when connected to my cars Bluetooth not android auto It connects to my car fine and works perfect as long as I have something playing but as soon as I pause the music the phone will randomly disconnect after about 10 or so secs and then reconnect which automatically resumes playback which can be annoying Bluetooth connection with my pixel watch and pixel buds seem fine and do not disconnect Ive tried stock android 14 with the latest updates and Ive tried android 15 qpr 1 beta 2 since it has a lot of Bluetooth fixes in the patch notes but the issue persists Any idea what could be going on ","9PXL intermittently disconnects from car's Bluetooth upon pausing music playback, while connections to Pixel watch and Pixel buds remain stable.","2024-09-27 14:07:16","Bluetooth Issues"
